Any celebrations not to be celebrated?	Perayaan apa waé sing aja nganti dirayakké?
Believe in your own design.	Percaya marang rancangan panjenengan dhewe.
Jewelry is rarely sold as a standard product in Cambodia.	Perhiasan jarang didol minangka produk standar ing Kamboja.
New user behavior is likely to change over time.	Perilaku panganggo anyar manawa bisa owah seiring wektu.
His struggle was then continued by his children.	Perjuangane banjur diterusaké anak-anake.
This can be understood by the gods.	Perkara iki bisa dingerteni dening para dwijane.
Matters in the family are accepted with care.	Perkara ing kulawarga ditampa kanthi legawa.
The marriage had taken place before the start of the season.	Perkawinan wis ditindakake sadurunge wiwitan mangsa.
That makes your friend critical.	Perkawis kuwi gawe kancamu kritis.
The development can be compared to a bicycle wheel.	Perkembangan bisa dibandhingake karo roda sepeda.
Their reproduction is done in a sexual and asexual manner.	Perkembangbiakané dilakoni kanti cara seksual lan aseksual.
The Japanese Ethnological Society got into trouble when it came to opening the museum.	Perkumpulan Etnologi Jepang pikantuk pepalang nalika ngemunah musiyum.
This association of mice wanted to solve this problem.	Perkumpulan tikus iki kepingin ngrampungaké masalah iki.
The fixture is tested with all LEDs at maximum settings.	Perlengkapan dites karo kabeh LED ing setelan maksimal.
Asset protection sometimes requires several forms.	Perlindhungan aset kadang mbutuhake sawetara formulir.
It should be noted that the evaluation must be conducted honestly.	Perlu dicathet evaluasi mau kudu dianakake kanthi jujur.
Need more information about logistics and shipping?	Perlu informasi luwih lengkap babagan logistik lan pengiriman?
It is necessary to create an atmosphere and a sense of fun.	Perlu kanggo nggawe atmosfer lan rasa seneng.
The problem has not been analyzed and a conclusion has been drawn.	Permasalahan punika nonten dianalisis lan dipendet setunggale kesimpulan.
Candy is eaten because of its leggy taste.	Permèn dipangan amarga rasa leginé.
Weddings can be really fun.	Pernikahan bisa bener-bener nyenengake.
His marriage was filled with controversy because he was accused of cheating.	Pernikahané dipenuhi kontroversi amarga dhèwèké dituduh minangka curang.
Libraries may implement similar methods.	Perpustakaan bisa uga ngleksanakake cara kaya-kaya.
Properly chosen competition increases your chances of winning.	Persaingan sing dipilih kanthi bener ningkatake kemungkinan menang.
This agreement is valid when the user is a user.	Persetujuan iki ditrapake nalika pangguna pangguna.
Exactly to the west of the field is in fact a cemetery.	Persis ing sisih kulon sawah kasunyatane ana kuburan.
Exactly when they last met, just before parting.	Persis nalika pungkasan ketemu, sak durunge pisahan.
Exactly on the other side of the shadows.	Persis neng seberang nggone nyong ngiyub.
Early setup can take time.	Persiyapan awal bisa nyebabake wektu.
First of all..in my friend's living room, myself, smoking.	Pertama ki..neng ruang tamu kancaku, dhewe, ngerokok.
These three battles were won by the allies.	Pertemuran cacah telu iki dimenangake sekuthu.
The company expects business.	Perusahaan iki ngarepake bisnis.
The company is a multinational business with large investments.	Perusahaan kasebut minangka bisnis multinasional kanthi investasi gedhe.
The company provides taxis, cabs to hire passengers.	Perusahaan kasebut nyedhiyakake taksi, taksi kanggo nyewa penumpang.
Our company is based in France.	Perusahaan kita adhedhasar ing Prancis.
State or private companies can conduct tenders.	Perusahaan negara utawa swasta bisa nindakake tender.
The company is really big in the luxury travel market.	Perusahaan saestu gedhe ing pasar lelungan mewah.
Companies can also be listed as micro companies.	Perusahaan uga bisa didaftar minangka perusahaan mikro.
The company has shown that the ads are overwhelming.	Perusahaan wis nampilake yen iklan kasebut akeh banget.
The company has reached many industries.	Perusahaan wis ngrambah akeh industri.
The officer Julius treated Paul very kindly.	Perwira Yulius tangkepé marang Rasul Paulus apik banget.
Competitors are skilled individuals.	Pesaing minangka individu sing trampil.
This aircraft can be entered on the carrier.	Pesawat iki bisa mlebu ing operator.
This message was translated using a translator.	Pesen iki dijarwakake nggunakake penerjemah.
The message is engraved on an aluminum board.	Pesen iki diukir ing Papan aluminium.
My order was finally changed to suit my taste.	Pesenanku akhire diganti cundhuk karo seleraku.
Participants at home should require care.	Peserta neng ngarep kudu mbutuhake perawatan.
Maps are managed as computer geographic information.	Peta wis dikelola minangka informasi geografis komputer.
Wine and citrus farmers in France and Spain.	Petani anggur lan jeruk ing Prancis lan Spanyol.
Farmers were formerly known as cotters.	Petani petani sadurunge dikenal minangka tukang cotter.
Farmers feel very happy and at peace.	Petani rumangsa seneng banget lan tenteram.
The officer from where I yes do not know.	Petugas saka ngendi aku ya ora ngerti.
Future calculations are absolutely unthinkable.	Petungan mangsa pancen ora bisa di­u­gemi.
The death penalty was carried out by customary leaders or kings.	Pidana pati katindakake dening pemimpin adat utawa raja.
The mind is the leader; 	Pikiran iku pimpinan;
they all work with their minds.	kabeh padha nggarap pikiran.
His mind does not know direction or compass.	Pikirane ora ngerti arah utawa kompas.
His thoughts go back to his high school and college days.	Pikirane maneh nalika jaman SMA lan kuliah.
My thoughts on this change?	Pikiranku babagan owah-owahan iki?
My mind was floating everywhere.	Pikiranku sansaya ngambang neng endi-endi.
My mind wandered to what happened twenty years ago.	Pikiranku nglambrang marang kedadeyan rongpuluh taun kepungkur.
Whose thoughts are written in the Bible?	Pikirané sapa sing ditulis ing Alkitab?
Think about whether children will be allowed at the wedding.	Pikiren manawa bocah bakal diijini ing pesta.
This pill helped me to even beat him.	Pil iki mbantu aku malah bisa ngalahake dheweke.
These pills are not cheap, and this is the first increase.	Pil iki ora murah, lan iki tambah pisanan.
Pilate said, "Shall I kill your king?"	Pilatus banjur kandha, ”Apa aku kudu matèni rajamu?”
Select it as an object.	Pilih minangka obyek.
Select an option below.	Pilih opsi ing ngisor iki.
Choose a simple recipe for homemade cake?	Pilih resep sederhana kanggo kue buatan?
Choose to rent, buy, or subscribe, and price yourself.	Pilih sewa, tuku, utawa lengganan, lan harga dhewe.
Select one of these areas and conduct an analysis.	Pilih siji wilayah kasebut lan nganakake analisis.
Select a color or browse the color palette.	Pilih warna utawa telusuri palet warna.
This option is suitable for long hair.	Pilihan iki cocok kanggo rambut dawane.
This option is considered very practical and reliable.	Pilihan iki dianggep praktis lan dipercaya banget.
The choice will depend on our personal preferences.	Pilihan bakal gumantung karo pilihan pribadhi kita.
The seat of the Regent is parallel to that of the Mayor.	Pilungguhan Bupati sejajar karo Walikutha.
Granted it is easy for you to find intelligence.	Pinaringan gampang anggonmu golek kepinteran.
Automatic switching but can be developed with frequent repetition.	Pindah otomatis namun saget dikembangaken kanthi kerep mbaleni.
Go to the appropriate category.	Pindhah menyang kategori cocok.
Go to advanced settings and click extensions.	Pindhah menyang setelan lanjut lan klik extension.
Go to an exhibition or college.	Pindhah menyang pameran utawa kuliah.
The elders in the congregation will talk to you.	Pinituwa ing jemaat bakal omong-omongan karo panjenengan.
Clever at work, and clever at labeling his country.	Pinter nyambut gawe, lan pinter labuh labet negarane.
The smart ones in school are the ones who are all smart.	Pinter sekolahe besuke dadine uwong ya pinter sakabehe.
How many invitations are distributed?	Pira undangan kang disebar?
These devices must be on the same wireless network	Piranti iki kudu ing jaringan nirkabel sing padha
Software to create and work with PDF-files.	Piranti lunak kanggo nggawe lan bisa karo-file PDF.
First move the scales with the scales.	Pisanan pindhahake timbangan kanthi timbangan.
The first is that it needs to be optimized quickly.	Pisanan yaiku kudu dioptimalake kanthi cepet.
First, blood was taken on an empty stomach.	Pisanan, getih dijupuk ing weteng kosong.
First, take off your shoes and rinse with cold water.	Pisanan, ngeculake sepatu lan ngumbahake banyu adhem.
First, you need to contact a women’s consultation.	Pisanan, sampeyan kudu ngontak konsultasi wanita.
Pits can be a means of transportation.	Pit bisa minangka piranti transportasi.
This question is not immediately addressed.	Pitakonan iki ora langsung ditangani.
The question is to God Almighty, what is my authority?	Pitakonan iku tumuju marang Gusti Mahakuwasa, apa wenangku?
The question is, can farmers do it themselves?	Pitakonan iku, bisa petani nindakake dhewe?
The question is, how will we respond to temptation?	Pitakonan iku, carane kita bakal nanggapi kanggo nggodha?
The following questions are correct!	Pitakonan ing ngisor iki kanthi leres !
That question frightened Peter.	Pitakonan kuwi nggawé Pétrus wedi banget.
The question of completing the image can determine the whole style.	Pitakonan ngrampungake gambar bisa nemtokake kabeh gaya.
The question for you is, “What does life say?”	Pitakonane kanggo kowe, "Apa urip ngomong?”
since they put it ..	sajaké padha nggenahaké..
Herbal help from health exercises.	Pitulungan jampi saking pakaryan kasarasan.
His words are noble. 	Pitutur kang adiluhung.
The lesson about the very small seed	Piwulang bab wiji sing tyilik banget
That lesson is still being taught today.	Piwulang mau nganti seprene isih diperdi banget.
He was in the midst of a situation that led to corruption.	Piyambak-ipun ing satengahing kawontenan ingkang ndayani nindakaken korupsi.
He wore my black stripes.	Piyambake nganggone ireng kula lorek-lorek.
He is referred to as "the foremost theologian of Christians."	Piyambakipun disebut minangka "Ahli teologi utami tiyang Kristen."
He is referred to as "the foremost theologian of Christianity."	Piyambakipun disebut minangka "Ahli téyologi utami tiyang Kristen."
He had frogs and lizards, and even bats.	Piyambakipun gadhah katak lan kadal, lan bahkan kelelawar.
He was clung to her, guided to the margins of salvation.	Piyambakipun karengkuh ing sihipun, katuntun ing margining kawilujengan.
He is passionate about comparative anatomy and paleontology.	Piyambakipun kepranan marang anatomi komparatif lan paleontologi.
He then I clung to the dormitory.	Piyambakipun lajêng saya nyakêt ing papan patilêman.
He was directly involved in the crisis in Ukraine.	Piyambakipun langsung melu ing krisis ing Ukraina.
He said, "Just why was he on this ship?"	Piyambakipun matur, "Nembé menapa piyambakipun ing kapal punika?"
He was the son of a Prussian hotel keeper.	Piyambakipun minangka putra satunggaling penjaga hotèl Prusia.
He began the old promised work.	Piyambakipun miwiti karya prajanji lawas.
He only has the right to be a ladder.	Piyambakipun namung nggadhahi hak minangka tangga kemawon.
He showed the world a cosmic form.	Piyambakipun nedahaken donya wangun kosmik.
He submitted his application but was immediately rejected.	Piyambakipun ngaturaken lamaran nanging langsung dipuntolak.
He had frogs and lizards, and even bats.	Piyambakipun nggadahi katak lan kadal, lan bahkan kelelawar.
He left his military as a general.	Piyambakipun nilaraken militeripun minangka satunggaling jenderal.
He gave speeches with soul and play.	Piyambakipun nindakaken pidato kanthi nyawa lan dolanan.
He was active in defending the rights of African slaves.	Piyambakipun sregep mbéla hak-hak para budak Afrika.
He is also packaged as a main character.	Piyambakipun ugi ngrangkep minangka juru paraga utama.
He is also listed as a screenwriter.	Piyambakipun ugi ngrangkep minangka panganggit skénariyo.
He also once had two rabbit tails.	Piyambakipun ugu natè gadhah kalih buntut kelinci.
How can these little kids be gifted photographers?	Piye bisane bocah-bocah cilik iki wasis dadi fotografer?
How do we nourish our souls and spirits?	Piye carane ngopeni jiwa lan rohani kita?
How did Jesus tell us more about the Kingdom of God?	Piyé Yésus ngandhani luwih cetha bab Kratoné Allah?
How can I take care of my sheep and livestock? '	Piyé aku isa njaga wedhus lan ternakku?’
How can humans be free from death?	Piyé carané manungsa isa bébas saka kematian?
Natural ports are not numerous in Algeria.	Plabuhan alami ora akèh cacahé ing Aljazair.
I entered the cave and climbed up.	Plangitanipun guwa wau saya mlêbêt saya ngêsong minggah.
The placenta is located in the middle, flanked by a spinal cord.	Plasenta dumunung ing tengah, diapit déning karangan wiji.
The school yard was crowded with children playing.	Plataran sekolahan rame bocah-bocah padha playon.
The corners of the eyelids are bright yellow.	Pojok pelupuk mata wernané kuning terang.
Basically a village boy. 	Pokoke bocah ndesa.
which I call pretty.	sing tak arani lumayan.
Basically all the needs of the school are not to be disappointed.	Pokoke sakabehe kebutuhane sekolah aja nganti nguciwani.
Basically if it looks unpleasant.	Pokokmèn nèk disawang ora nyenengké.
Basically the boy is fine.	Pokoké bocahé berès.
The flower pattern will enhance these nails.	Pola kembang bakal ningkatake kuku iki.
Patterns appear unintentionally created.	Pola muncul tanpa digawe kanthi sengaja.
The police can only sigh.	Polisi mung bisa kedhah-kedhih.
Environmental pollution can be dangerous to human life.	Polusi lingkungan bisa dadi bêbaya marang uripé manungsa.
Pornography and pornography have reached the villages.	Pornografi lan pornoaksi wís ngambah têkan ndéså-déså.
Dear audience!	Poro Hadirin ingkang kulo hormati !
Everyone and the committee ..	Poro dulur lan panitia..
The Muslims who attended the Friday session were very grateful.	Poro kaum muslimin hadirin sidang jum’at ingkang minulyo.
All in all, we respect you.	Poro hadirin sedoyo ingkang kawulo hormati.
Portals like this are already editable.	Portal-portal kaya mengkéné wis bisa disunting.
Position as a striker.	Posisi minangka penyerang.
The position in the first six months took a lot of effort.	Posisi ing enem wulan pertama njupuk akeh upaya.
His position is as Striker.	Posisiné minangka Penyerang.
Its position is the central gland.	Posisiné ya iku glandhang tengah.
His position is that of a defensive gland.	Posisiné ya iku glandhang bertahan.
Potiphar was very angry, even though it was not true.	Potifar dadi nesu banget, padahal kuwi ora bener.
The revenue-raising potential for the Japanese government could be significant.	Potensial revenue-mundhakaken kanggo pemerintah Jepang bisa dadi wujud.
This piece has one simple function.	Potongan iki nduweni siji fungsi prasaja.
The cost is borne by the government.	Prabéya dipuntanggung pamaréntah.
Believe in Him. 	Pracaya marang Panjenengane.
trust Him.	dipercaya Panjenenganipun.
Believe it or not, this is not true.	Pracaya utawa ora, iki ora bener.
The sailboat continued forward to never to the east.	Prahu layar terus maju menyang pernah sisih wetan.
Treaty of Women Against Germany and Italy.	Prajanjian wados Tumrap Jerman kalihan Italie.
The land and sea soldiers were forced to spend a lot of time.	Prajurit dharatan lan lautan kêpêksa dilongi akèh.
Agricultural matters were also liberated.	Prakara tetanèn iya dimardikakaké.
Predictably, people are just mistakenly looking at it.	Prakiraan, tiyang namung salah ningali kemawon.
That is why virtue is the foundation of nation building.	Pramila budi pekerti dados landesan pambangunaning bangsa.
That’s why it’s easy to have a fake profile on the site.	Pramila gampang nduwe profil palsu ing situs kasebut.
That’s why I’m going to visit Copenhagen in comfort.	Pramila kulo bade ngunjungi Kopenhagen kanthi nyaman.
So then the order went down, harassing his soldiers.	Pramila lajêng tata-tata nglurug, anggêgabah prajuritipun.
That's why children's toy songs should be sung.	Pramila tembang dolanan anak wajib dipun uri-uri.
That is why there is a hadith that states;	Pramila wonten hadits ingkang nelakaken ;
France intends to retaliate.	Prancis niyat badhe nyêpêng dêdamêl malih.
It turned out that his life was very difficult.	Pranyata uripe dheweke susah banget.
The inscription on the bottle is in black.	Prasasti ing botol ing ireng.
This monument is made of stone ...	Prasati iki digaé saka bahan watu...
This event is considered the beginning of the French Revolution.	Prastawa iki dianggep wiwitané Révolusi Prancis.
The barber's statement did not want to be named.	Pratelane tukang cukur kang ora gelem dicatet jenenge.
High performance.	Pratingkah sing dhuwur.
Collective indicators include housing starts, GDP and inflation.	Pratondho bebarengan kalebu omah wiwit, PDB lan inflasi.
The boat he was going to ride was a bicycle.	Prau kang bakal ditunggangi mau anuli mancal.
The girl with the split chin was away.	Prawan sing dagune mbelah iku ngedoh.
He should use his own words.	Prayoginipun ngginaaken tembung dhéwéké.
Great things can be done with great effort.	Prekara gedhe bisa ditindakake kanthi upaya besar.
The president of a college is the leader of a college or university.	Presiden kuliah minangka pimpinan perguruan tinggi utawa universitas.
Achievements that deserve to be noted in gold ink!	Prestasi sing pantes cinathet nganggo tinta emas!
The person sitting on the throne said, ‘Look!	Pribadi sing lungguh ing tahta kuwi ngendika, ’Deloken!
Concerned about his own environment.	Prihatin marang lingkungane dhewe.
Really concerned, because such dhalangs are usually not alone.	Prihatin tenan, amarga dhalang kuwi biasane ora dhewekan.
Check because there is a problem.	Priksa amarga ana masalah.
Concerned he has been able to shake hands with his parents.	Prihatini wis bisa gojeg karo wong tu­wane.
Make our Password strong to create a secure account.	Priksa Sandi kita kuwat kanggo nggawe akun aman.
Check out the original list and references!	Priksa daftar asli lan referensi!
Make it hot and passionate.	Priksa iku panas lan hasrat.
Check out China’s contribution to the development of agricultural machinery.	Priksa kontribusi kanggo pangembangan mesin tetanèn China kang.
Check it out using our own income calculator.	Priksa kanthi nggunakake dhewe kalkulator penghasilan kita.
Take a serious look at your research.	Priksa kanthi serius ing riset.
Make sacrifices to others about Christ.	Priksa kurban marang wong liya bab Kristus.
Check the location of the interview the day before.	Priksa lokasi wawancara ing dina sadurunge.
Make sure there is a great feeling from the beginning.	Priksa manawa ana perasaan gedhe saka awal.
Make sure it has a new photo of itself.	Priksa manawa iku wis foto anyar saka dhewe.
Make sure to follow these simple steps.	Priksa manawa ngetutake langkah-langkah prasaja iki.
Make sure the patient can breathe.	Priksa manawa pasien bisa ambegan.
Make sure you have pressure!	Priksa manawa sampeyan duwe tekanan!
Make sure your page is fun and unique.	Priksa manawa sampeyan kaca nyenengake lan unik.
Make sure you use local transportation.	Priksa manawa sampeyan nggunakake transportasi lokal.
Make sure not to wear your legs.	Priksa manawa supaya ora nyandhang sikil.
Make sure to always get permission, though.	Priksa manawa tansah njaluk ijin, sanajan.
Make sure your actions are positive and supportive of your peers.	Priksa manawa tumindakmu positif lan ndhukung kanca-kanca rekanmu.
Check the charge and flight time of the batteries.	Priksa muatan lan wektu penerbangan saka batre.
Make your product more convenient, efficient and effective.	Priksa prodhuk luwih trep, efisien lan efisien.
Check out some interesting facts about life right now.	Priksa sawetara fakta menarik babagan urip saiki.
Find out the purpose of God’s command mentioned above.	Priksanana maksud dhawuhe Allah kang katur ing ndhuwur.
Please check the links to this template before deleting. ',	Priksanen dhisik pranala-pranala menyang cithakan iki sadurungé mbusak.',
Behavior in the meeting should be natural and relaxed.	Prilaku ing patemon kudu alam lan anteng.
Behave with enthusiasm.	Prilaku karo semangat.
Chinese consumer behavior is a major focus.	Prilaku konsumen Cina minangka fokus utama.
The bamboo was then crushed with both hands.	Pring mau banjur diremukke nganggo tangan lorone.
The principle of making rubber bands is very simple.	Prinsip panggawéyan karet gelang sedherhana banget.
How do I go back to Portuguese?	Pripun aku bali menyang Portugis?
How do I get the installation right now?	Pripun anggenipun kula bisa mendhet instalan sak punika?
How do I change the flag in this case?	Pripun ngganti panji ing ngono?
What if I go to your house tomorrow?	Pripun umpami kula tindak dateng dalemipun panjenengan benjing?
Your privacy is very important to us.	Privasi sampeyan penting banget kanggo kita.
Men are perfect with women.	Priya punika sampurnanipun kanthi wanita.
The man who can embrace this stone,	Priya sing bisa ngrangkul watu iki,
The man was tall, stocky, and wore a beard.	Priyayine dhuwur, bregas, tur nganggo brengos.
The product can be called popular, but it is not affected.	Prodhuk bisa diarani populer, nanging ora kena pengaruh.
This product made me a mix of impressions.	Prodhuk iki digawe kula campuran kesengsem.
Products can be manufactured according to your request.	Produk bisa diprodhuksi miturut penjenengan.
The product is half coated or rolled by rolling.	Produk dilapisi setengah utawa digulung kanthi muter.
Our products are innovative, unique and simple to use.	Produk kami inovatif, unik lan prasaja digunakake.
The product has a special effect on the skin.	Produk kasebut duwe efek khusus ing kulit.
The product can be a wonderful gift.	Produk kasebut bisa dadi hadiah sing apik banget.
Prohormones are an affordable solution for maximum hormone results.	Prohormone minangka solusi terjangkau kanggo asil hormon maksimum.
This promotion does not require an extra discount code!	Promosi iki ora mbutuhake kode diskon ekstra!
Prose is a work of fiction.	Prosa minangka karya awujud fiksi.
This procedure is usually performed in a private cosmetic center.	Prosedur iki biasane dileksanakake ing pusat kosmetik pribadi.
This procedure can be performed in a non -specific way.	Prosedur iki bisa dilakokaké kanthi ora khusus.
The procedure is performed under local anesthesia.	Prosedur iki dileksanakake miturut anestesi lokal.
This procedure is performed before and after surgery.	Prosedur iki ditindakake sadurunge operasi lan sawise iku.
This procedure makes it a client.	Prosedur iki ndadekake iku klien.
The procedure of the sequence is also great.	Prosedur saka urutan uga gedhe.
The procedure of the sequence is also great. 	Prosedur saka urutan uga gedhe.
I'm happy ".	aku seneng".
The process by which color plays an important role.	Proses ing endi warna nduweni peran penting.
The process can take hours.	Proses kasebut bisa njupuk jam.
The whole cooking process will not take more than an hour.	Proses masak kabeh bakal ora ngluwihi jam.
This process is called mutarotation.	Prosès iki disebut minangka mutarotasi.
The process of release from the ovaries is called ovulation.	Prosès uculé saka ovarium disebut ovulasi.
Prussia if melted could also be copper.	Prusi yèn dilêbur iya bisa dadi têmbaga.
The president appoints the prime minister, who heads the government.	Présidhèn nunjuk perdana mentri, kang ngepalani pamaréntahan.
Poetry is the result of the creation of one's intellect.	Puisi ngrupiaken asil kreasi keinanan setunggale tiyang.
The police need to move forward in order to support democracy.	Pulisi kudu maju supaya bisa ngamping-ampingi démokrasi.
The island is listed as a National Historic Site.	Pulo iki kadaftar minangka Tempat Bersejarah Nasional.
What are the things recorded in the Gospels about Jesus?	Punapa bab-bab ingkang kacathet ing Injil ngengingi Yesus?
What are we going to do?	Punapa ingkang badhe kita tindakaken?
What does the Bible say?	Punapa ingkang dipun ngendikakaken dening Kitab Suci?
What does God want?	Punapa ingkang kakersakaken dening Gusti Allah?
What makes Paul like this?	Punapa ingkang njalari Paulus kados mekaten punika?
What do you feel when you talk about children?	Punapa ingkang panjenengan galih menawi ngrembag bab anak-anak?
What should be done.	Punapa ingkang prayogi dipunlampahi.
Should I choose what to cook?	Punapa kedah milih ingkang dipun masak?
Have we also done what the Lord commanded?	Punapa kita ugi sampun nindakaken dhawuhipun Gusti?
Moreover, they are only trying to get what they want.	Punapa malih hanamung nyadhong paparingipun tiyang sanѐs.
Have you ever asked to be given a need?	Punapa nate panjenengan nyenyuwun mugi kaparingana karibedan?
What has been said during the meetings in our church.	Punapa sampun kapratelakaken nalika rapat-rapat ing pasamuwan kita.
Is there a clear rule?	Punapa wonten angger-anggeripun ingkang cetha?
The same goes for the people of his family and some of his children.	Punapadene dhatêng tiyang sakulawarganipun saetanging anak-anakipun.
As well as the elders of his people.	Punapadene kamisêpuh kaumipun.
In the same way, the anger of those who do evil to the gods.	Punapadene marah patrapipun tiyang nandukakên dêdamêling dewa.
Where is a God as great as my God?	Pundi wonten Allah ingkang luhur kados Allah kawula?
Last year you couldn’t beat Commander Three.	Pungkasan taun sing ora bisa ngalahake Panglima Tiga.
Last year I was diagnosed with Depression.	Pungkasan taun aku iki diaknosa karo Depresi.
