And it will last forever.	Lan iku bakal tetep ana ing salawas-lawase.
And it’s better not to lose.	Lan iku luwih apik ora kanggo ilang.
And it’s not a new development.	Lan iku ora dadi pembangunan anyar.
And here we finally come to the point.	Lan ing kene kita pungkasane teka ing titik.
And on the eternal border will be upon his head.	Lan ing ngatase langgeng bakal marang kepala.
And in his mind, we are talking about wages.	Lan ing pikirane, kita ngomong babagan upah.
And at the end of the show,	Lan ing pungkasane pagelaran,
And in the end, the most extreme choice.	Lan ing pungkasan, paling nemen pilihan.
And the speed of the glass is slow to crawl.	Lan kacepetan kaca perlahan menyang nyusup.
And for the kids?	Lan kanggo bocah-bocah?
And to violate international fraud.	Lan kanggo nerak penipuan internasional.
And when that happens, it’s impossible to be sure.	Lan kapan titi wancine, ora bisa dipesthekake.
And as mentioned above; 	Lan kaya kasebut ing ndhuwur;
And we expect to move into the Indian job market.	Lan kita ngarepake pindhah menyang pasar kerja India.
And vice versa as if defending Mary.	Lan kosokwangsulipun kados-kados mbelani Maria.
And you came here with bad news!	Lan kowe teka mrene kanthi nggawa kabar ala!
And this letter is written in context.	Lan layang iki ditulis ing konteks.
And the immediate environment is a micro- or macroenvironment.	Lan lingkungan langsung kasebut mikro- utawa makroenvironment.
And then who saved us…. 	Lan malih sinten ingkang nylametaken kito….
And make sure to retire well after a certain period of time.	Lan manawa pensiun apik sawise wektu tartamtu.
And the main problem is the limited missions.	Lan masalah utama iku misi sing winates.
And of course Start a new Career in the Middle East.	Lan mesthi Mulai Karir anyar ing Timur Tengah.
And when something is taken by hunting,	Lan nalika wis dijupuk soko dening mburu,
And manage this Italian company properly.	Lan ngatur perusahaan Italia iki kanthi bener.
And do you know what eventually moved you to trust Christ?	Lan ngerti apa pungkasanipun dipindhah menyang dipercaya Kristus?
And use it to create a profile with this company.	Lan nggunakake nggawe profil karo perusahaan iki.
And put the day into the night.	Lan nglebokake rina ana ing wengi.
And save lives and property.	Lan nylametake urip lan properti.
And try to get along by a lawyer.	Lan nyoba kanggo njaluk bebarengan dening pengacara.
And a middle size house with a pool.	Lan omah ukuran tengah karo kolam renang.
And it can’t be diabetic, because it’s a lot of sugar.	Lan ora bisa diabetis, amarga akeh gula.
And no one can face his actions.	Lan ora ana kang bisa ngadepi polahe.
And is it not possible to implement both?	Lan ora bisa kanggo ngleksanakake loro kasebut?
And they were famous women.	Lan padha dadi wanita kesuwur.
And they live together in peace. "	Lan padha uripa bebarengan kanthi rukun."
And they live together in peace. ”	Lan padha uripa bebarengan kanthi rukun.”
And the breaking of the heart is by the presence of lust.	Lan pecahe ajakane ati iku kanthi anane nafsu.
And the disease will get faster.	Lan penyakit bakal luwih cepet.
And the fundamental role of Germany?	Lan peran sing dhasar Jerman?
And it needs to be done immediately after the first symptoms.	Lan perlu ditindakake kanthi cepet sawisé gejala pisanan.
And its own significance among them is charity.	Lan pinunjul dhewe ing antarane iku amal.
And the end is unbeatable!	Lan pungkasan ora bisa ngalahake!
And finally, she needs hot sex passion.	Lan pungkasanipun, dheweke perlu hasrat jinis panas.
And because of that two children can be found.	Lan saka lantaran iku bocah loro bisa tinemu.
And next month, it could be the core plan.	Lan sasi sabanjuré, iku bisa dadi rencana inti.
And that’s largely because we forgot a third of this.	Lan sing umumé amarga kita lali saprateloné iki.
And sometimes expatriates can find jobs in Canada.	Lan sok-sok ekspatriat bisa nemokake proyek ing Kanada.
And those shops, cafes or restaurants will close.	Lan toko, warung utawa restoran mau bakal tutup.
And the rain didn’t stop from four o’clock in the afternoon.	Lan udan ora mandheg saka jam papat sore.
And it can also give organic and inorganic information.	Lan uga bisa menehi katrangan organik lan anorganik.
And nor should they, ”he said.	Lan utawa ngirim padha,” ngandika.
And since you land on our page.	Lan wiwit sampeyan nampa ing kaca kita.
And since you landed on our page.	Lan wiwit sampeyan ndharat ing kaca kita.
And he has received many gifts.	Lan wus pirang-pirang anggone tampa peparing.
And, of course, you don’t have to neglect yourself, your lover.	Lan, mesthi, sampeyan ora kudu nglirwakake dhewe, kekasihmu.
And, finally, about the materials.	Lan, pungkasanipun, babagan bahan.
Is it okay, sir? "I asked.	Lancar nggih pak acarane?" saya menimpali.
His landlord was stuck in the ground.	Landheyan ipun tinancepaken ing lemah.
This step can take quite a while.	Langkah iki bisa njupuk nalika cukup.
The next step is to enable the ads feature.	Langkah sabanjure kanggo ngaktifake fitur iklan.
Just read below to understand.	Langsung wae diwaca ing ngisor iki supaya paham.
The floor can be used for many years.	Lantai bisa digunakake ing pirang-pirang taun.
I can borrow a paddle and a handlebars.	Lapak lan kêndhali aku bisa nyilihi.
The stall is a symbol of the gods.	Lapak mau minangka pralambange para dewa.
Reports about the work produced are available on request.	Laporan bab karya diprodhuksi kasedhiya ing dikarepake.
The report is a work of art!	Laporan kasebut minangka karya seni!
Inorganic solids cannot melt in the soil.	Larahan anorganik ora bisa lebur ing lemah.
Larvae enter the body.	Larva lumebu ing awak.
Neutral background and contrast yellow or blue.	Latar mburi netral lan kontras kuning utawa biru.
Exercise can also prevent premature ejaculation in men.	Latihan uga bisa nyegah pramatang éjakulasi ing pria.
The door is at the front and has fasteners.	Lawang ana ing ngarep lan nduweni fastener.
The door could not be closed, and it was very rusty.	Lawange ora bisa diinepake, tur wis teyengan pisan.
Older women take more responsibility.	Lawas wanita njupuk luwih tanggung jawab.
Emergency services are provided for intervention.	Layanan darurat disediakake kanggo intervensi.
The service can be downloaded for free.	Layanan iki bisa diundhuh kanthi gratis.
The service can be downloaded for free.	Layanan iki bisa diundhuh sacara gratis.
Our service is quite transparent and very well determined.	Layanan kita cukup transparan lan ditemtokake apik banget.
Customer service and I received my hair quickly.	Layanan pelanggan lan aku nampa rambutku kanthi cepet.
Social services make contact.	Layanan sosial ndadekake kontak.
The service will always be something I will remember forever.	Layanan tansah bakal aku eling nganti kapan.
Emails can be considered personal letters.	Layang iber-iber bisa kaarani layang pribadhi.
No, this work is a big responsibility.	Le, penggaweyan iki tanggung jawabe gedhe.
Relieved, it seemed, I went to the kitchen.	Lega, rasane, aku banjur menyang kolah.
Both can be mixed directly, or made into juice.	Lelorone bisa dirahabi langsung, utawa digawe jus.
Traveling can be fun.	Lelungan bisa nyenengake.
The earth is of human origin.	Lemah iku asal usule manungsa.
Soil in such aquariums is not necessary.	Lemah ing akuarium kuwi ora perlu.
The land in this village includes red soil.	Lemah ing désa iki kalebu lemah abang.
The soil and air of this space are then immediately combed.	Lemah lan udara papan iki banjur langsung disisir.
Oily skin has plagued me since adolescence.	Lengis berminyak wis ngganggu aku wiwit remaja.
The lens can be distinguished from the shape of its sides.	Lensa bisa dibedakake saka wujud sisih-sisine.
The contact lens is a fast -moving version.	Lensa kontak minangka versi kacepetan kacepetan.
The eruption killed the southwest side of the mountain damaged.	Letusan punika nyababaken ndamel sisih kidul-kilenipun gunung rusak.
Who are we?	Lha awake dhewe iki sapa?
What is the difference between hair and hair?	Lha apa to bedané rambut lan wulu?
So why did you suddenly wear a horn show?	Lha kenapa kok ndadak ngganggo acara ngunekke klakson?
You do not know my situation now.	Lha kowe rak ngerti dhewe kahananku saiki.
Look at the frying pan ears, he is said to have never noticed.	Lha kuping wajan, dikandhani ora tau nggatekake.
Well, that's according to my own experience.	Lha nek iku miturut pengalamanku dhewe.
Is it obligatory to protect the people? ”	Lha ngayomi rakyat kan wajib?”
Look at the day at the cattle market.	Lha njelalah dino iku pas pasaran sapi.
See how they cook?	Lha njuk piye anggone padha masak?
Look, he wants to go to heaven.	Lha wong nyong dhewek be mbuh-mbuhan mlebu suwarga.
Well, why can it be a disaster?	Lha, geneya kok bisa dadi memala?
Don't worry, next year I'll follow!	Liat aja, taun depan gw bakal ikutan!
Candles have a shelf life of five years.	Lilin nduweni umur simpenan limang taun.
Naturally a mother is overwhelmed by her child.	Limrahipun biyung punika kaêrèh dening anakipun.
Naturally healed by being dealt with.	Limrahipun saras dening dipun urus-urusi.
The seat is still fixed in the chair normally.	Lingguhe isih tetep nang kursi biasane.
A damaged natural environment will have an effect	Lingkungan alam sing rusak bakal nduweni efek
The environment includes biotic and abiotic environments.	Lingkungan kalebu lingkungan biotik lan abiotik.
A clean environment can make life healthier.	Lingkungan sing resik bisa dadekake urip sehat.
A clean environment can lead to a healthy life.	Lingkungan sing resik bisa ndadekake urip sehat.
The star of happiness in the west.	Lintang kabegjan ing sisih kulon.
The abysmal stars accompany the moon facing the full moon.	Lintang-lintang abyor ngiringi rembulan ngadhepi purnama.
Lithium is very reactive, never found pure.	Litium iku reaktif banget, ora tau ditemokaké murni.
Through this hope, we draw near to God.	Liwat pangarep-arep iki, kita nyedhak marang Gusti Allah.
Over time the law has developed in a broader industry.	Liwat wektu hukum wis dikembangaké ing industri ngembake.
Other times, timing can be a big factor.	Liyane kaping, wektu bisa dadi faktor amba.
Another like that, is history.	Liyane kaya sing kasebut, yaiku sejarah.
Others stand somewhere or slump on the floor.	Liyane ngadeg wae utawa nglesot ing jogan.
Others create trading robots based on unique algorithms.	Liyane nggawe robot dagang adhedhasar algoritma unik.
Others involve the birth of their children.	Liyane nglibatake lair saka anak-anake.
Others check with gems.	Liyane nyemak kanthi permati.
Another suggestion is to focus on quality, not quantity.	Liyane saran kanggo fokus ing kualitas, ora jumlah.
Others you can manage.	Liyane sing bisa ngatur.
Other times it’s not.	Liyane wektu iku ora.
Others are because they are trapped on duty.	Liyane ya amarga kepepet tugas.
The rest, as they say, is now history.	Liyane, minangka lagi ngomong, saiki wis dadi sejarah.
The geographic location is determined using a wireless network	Lokasi goegrafis ditemtokake nganggo jaringan nirkabel
A pleasant location yielded half the success.	Lokasi sing nyenengake ngasilake setengah sukses.
The location of the station or lock may vary.	Lokasi stasiun utawa kunci bisa uga beda.
These two prophecies proved to be true.	Loro iki lah padha mbuktekaken dadi bener.
Two horses protect against an accidental fall.	Loro jaran nglindhungi ambruk ora disengaja.
The two could not talk to each other.	Loro ora bisa diajak saben liyane.
Both will come out of one land.	Loro-lorone bakal metu saka siji tanah.
Both have got exactly what they need.	Loro-lorone wis entuk persis apa sing dibutuhake.
Both of these extreme positions have risks and benefits.	Loro-lorone iki posisi nemen duwe risiko lan keuntungan.
They were both so talented.	Loro-lorone padha dadi bakat.
Both parents and children can rejoice together.	Loro-lorone wong tuwa lan bocah bisa bungah bebarengan.
They will both fall into the ditch, won't they? ”	Loro-loroné mesthi bakal kecemplung kalèn, ta?”
Lotteries are held on certain days.	Loteri dianakake ing dina-dina tartamtu.
The painting is based on mood and shape.	Lukisan kasebut adhedhasar adhedhasar swasana lan wujud.
These paintings were completed before he went to Italy.	Lukisan-lukisan iki dirampungaké sadurungé dhèwèké lunga menyang Italia.
Passed the exam for military higher education.	Lulus examen tumrap pamulangan luhur militèr.
Quite a lot of it can be used to enhance the experience.	Lumayan lho iku iso dinggo nambah pengalaman.
Naturally it is staged in pairs.	Lumrahe dipentaske kanthi pasang-pasangan.
The nature of Africa is dry land.	Lumrahe wewengkon Afrika awujud lemah kang garing.
It’s natural for “normal” people to be disappointed.	Lumrahe wong sing "normal" dadi kecewa.
Naturally add ice to keep it fresh.	Lumrahé ditambah ès supaya seger.
Naturally all cultures lived in the kingdom.	Lumrahé kadayan budaya sing urip ning kratonan.
Naturally the whistle is blown by blowing the mouthpiece.	Lumrahé sempritan diunekake kanthi disebul cangkem.
Naturally it is a motor vehicle.	Lumrahé minangka kendaraan bermotor.
Go your way, and from now on sin no more! "	Lungaa, lan wiwit saiki aja gawe dosa maneh!"
Go your way, and from now on sin no more! ”	Lungaa, lan wiwit saiki aja gawe dosa maneh!”
The headman is under and responsible to the Head.	Lurah nangisore lan tanggung jawab maring Camat.
More and more weddings and circumcisions.	Luwih akeh eneng kawinan lan sunatan.
Better in the morning.	Luwih apik ing wayah esuk.
More suitable for use at casual events.	Luwih cocog digunakaké ing acara kasual.
It is better described as metabolism.	Luwih diterangake minangka metabolisme.
More so in the summer.	Luwih ing mangsa panas.
More often it is a disease.	Luwih kerep iku minangka penyakit.
More honorable than being a traitor! ”	Luwih mulya ketimbang dadi pengkhianat!”
More than anything this didn’t bother me.	Luwih muput iki ora nempuh marang aku.
More than two billion crystals are produced a year.	Luwih saka rong milyar kristal sing diprodhuksi taun.
Further, laboratory tests should be based on physician advice.	Luwih, laboratorium tes kudu adhedhasar dokter saran.
Further, non-probability examples are certainly cheaper.	Luwih, conto non-kemungkinan mesti luwih murah.
Especially when the self is dominated by worldly lust.	Luwih-luwih nalika dhiri dikuwasani dening nepsu kadunyan.
Rivers are a continuous food chain.	Lèpèn mujudaken ranté pakan ingkang lumintu.
The cloud was taken up again into heaven.	Lèmèké terus diunggahké menèh nang langit.
Mom, forgive your son who doesn’t deserve to be your son.	Ma, ngapuranen anakmu sing ora pantes dadi anakmu.
Read books in the fields of business, psychology, or economics.	Maca buku ing bidang bisnis, psikologi, utawa ekonomi.
Reading a poem is a must face.	Maca geguritan iku kudu njawani.
Read and understand the terms and conditions.	Maca lan ngerti syarat-syarat lan kahanan.
Playing cards or drinking alcohol is a taboo.	Main kartu utawa ngombe minuman keras dadi pantangan.
Magazines and newspapers are another option.	Majalah lan surat kabar minangka pilihan liyane.
That’s why I compare the downloads above.	Makane aku mbandhingake download ing ndhuwur.
So in my personal opinion.	Makaten miturut pendapat kula pribadi.
That's why the United States is against the Philippines.	Makatên ugi mênggahing Amerika tumrap dhatêng Filippinah.
The meaning can be death and dying.	Makna kasebut bisa dadi kematian lan pati.
The purpose is to hide the fact that the children do not understand.	Maksudé nggo nglimur bèn bocah-bocah ora pada ngarti.
The angels are called Satan or the Devil.	Malaekat iku diarani Setan utawa Iblis.
Even I can beat you easily ”.	Malah aku bisa ngalahake kowe kanthi gampang".
Even many people don’t care about the environment.	Malah akeh wong sing ora peduli marang lingkungan.
In fact, there are those who go out of their way to wear salons.	Malah ana kang jor-joran banter-banteran nganggo disalon.
Some even consider it more embarrassing!	Malah ana kang nganggep luwih ngisin-isini!
Even children can have demons.	Malah anak bisa duwe dhemit.
Even then he told all the villagers.	Malah banjur ngomong marang kabeh warga desa.
It can even cause fainting or loss of consciousness.	Malah bisa nyebabake semaput utawa ilang kesadharan.
In fact she even vowed to be sexy when needed.	Malah dheweke uga saguh dadi seksi nalika dibutuhake.
Even at night or on the weekends.	Malah ing wayah mbengi utawa ing akhir minggu.
Even human beings are more glorious than Angels.	Malah jejering manungsa iku luwih mulya katimbang Malaikat.
Even as if the people or their children were shaken.	Malah kaya-kaya rakyat utawa anake mau digegering.
He even had to take medicine for his stomach, '' said his mother.	Malah kena nggo tamba sumuk,’’ kongkone biyunge.
Even more attractive is also a massage chair.	Malah luwih atraktif uga dadi kursi pijet.
Even worse than death.	Malah luwih èlèk ketimbang mati.
Even a coffee table can be dangerous for children.	Malah meja kopi bisa mbebayani kanggo bocah-bocah.
Even the country has ownership,	Malah nagari ugi kagungan pamêlikan,
Even to the point of forgetting about the children	Malah nganti kêpårå nglalèkaké marang anak-anak
Even couples don’t lag behind when it comes to tattooed pigeons.	Malah pasangan ora ketinggalan nalika nyedhaki dara tato.
Even each area has its own characteristics.	Malah saben dhaerah nduweni ciri khas dhewe-dhewe.
Even in life it does not feel like it is going to die.	Malah sajroning urip ora rumasa yèn bakal mati.
Even though it's Arabic…	Malah sanadyan kang arab…
Even some foods look good to eat.	Malah sawernaning panganan katon enak dipangan.
In fact, there are angels in heaven who are evil.	Malah, ana malaékat-malaékat ing swarga sing dadi jahat.
In fact many even consider it ‘contrary’ to the teachings	Malah-malah akeh uga kang nganggep ‘bertentangan’ karo ajaran
In fact, it may be, just in the past.	Malah-malah, bisa uga, nembe ing jaman kapujanggan.
It can even exert antioxidant power.	Malahan bisa nu­wuhake daya anti oksidan.
Even if I count it more than ten years.	Malahan yen daketung wis luwih saka sepuluh tahun.
The angel said, "Put on your cloak and follow me."	Malaékat tumuli ngandika, "Jubahmu anggonen lan ngetutna aku!"
Show off to the heights of your knowledge.	Mamerake menyang duwure ilmune.
Managers can make right or wrong decisions.	Manajer bisa nggawe keputusan sing bener utawa salah.
Managers and employees wearing masks give a message.	Manajer lan karyawan sing nganggo topeng menehi pesen.
If I can’t I will continue to tell the experts.	Manawa aku ora bisa bakal dakterusake marang ahline.
If any child is twenty -seven months old.	Manawa ana bocah wus umur pitu likur sasi.
Whether it’s in the industry, or another manufacturer.	Manawa ana ing industri, utawa pabrib seje maneh.
Sure it can be scary.	Manawa bisa dadi medeni.
Sure he wouldn't refuse.	Manawa dheweke ora bakal nolak.
That the knowledge in this book has been biased.	Manawa kawruh ing kitab iki wus bias kagayuh.
When the Almighty is taken away, it is yours	Manawi dipunpundhut ingkang Mahakuwasa, sarira paduka
If they keep your word.	Manawi netepi ing pangandika Paduka.
If the word "Dutch" is appropriate for what phrase?	Manawi tembung "Nèderlan" prayoginipun kanggé ing frasa punapa?
A pair of spikes or a sick gravel cow.	Mancik pasangan utawa sapi kerik gerang.
Again, a detailed description of the potential and business order	Maneh, gambaran rinci ing urutan potensial lan bisnis
Eating the usual crackers was held on the seventeenth race.	Mangan krupuk biyasa dianakke ana ing lomba pitulasan.
Learn how to make your own food and healthy snacks.	Mangerteni carane nggawe pangan dhewe lan sehat cemilan.
Understandably, your rudeness makes my body dirty.	Mangertia, anggonmu lancang njalari awakku dadi jember.
Please do not hesitate to ask further questions.	Mangga aja ragu-ragu ngomongake pitakonan luwih lanjut.
Please bury me with your forgiveness.	Mangga dipendem nganggo pangapuramu.
Please be advised.	Mangga dipunpratelakaken.
Please merge the talk pages manually. ',	Mangga kaca-kaca dhiskusi wau digabung sacara manual.',
Please attach one or more appropriate images.	Mangga masang siji utawa luwih gambar cocok.
years.	taun.
Please order with confidence.	Mangga supaya kanthi yakin.
Place him with his match.	Manggonake dheweke kanthi tandhingane.
Then why do you not fear Him ”.	Mangka kenapa sira ora padha taqwa marang Panjenengane”.
Then the costumes and equipment are also complete.	Mangka kostum lan peralatane uga lengkap.
So school is a struggle.	Mangka sekolah iku ya butuh perjuangan.
It will then be explained by the study committee.	Mangke badhe dipun têrangakên dening panitya bôndha pasinaon.
That way it’s easier.	Mangkene iku luwih gampang.
So far, we haven’t done anything.	Mangkene nganti saiki, kita durung nindakake apa-apa.
Thus the aluminum head screw, you can see the picture ...	Mangkene skru kepala aluminium, sampeyan bisa ndeleng gambar...
Thus, the power of science has been written. 	Mangkene, kekuwatan ilmu wis ditulis.
Thus lies the reality of what is happening in the midst of society.	Mangkono genahe kasunyatan kang dumadi ing tengahing masyarakat.
Thus it can be said of meaning and function	Mangkono iku bisa bilih makna lan fungsi
Thus it can be called a "woman's mustikhan".	Mangkono iku kena diarani dadi “mustikhaning wanita”.
So do it until the end of the war.	Mangkono iku tindakna nganti tekan rampunge perang.
Thus it has become a statute.	Mangkono iku wis dadi pranatan.
Thus we can turn on energy.	Mangkono kita bisa nguripake energi.
Thus it also brings to the Lord's wrath.	Mangkono iku uga nêkakake marang apêsing Pangeran.
Such is the expectation of all parents for their children.	Mangkono lumrahe pangajeng-ngajenge kabeh wong tuwa tumprap putra-putrane.
Thus defeating every enemy!	Mangkono ngalahaké saben mungsuh!
So it is with sacrifice, asceticism and funds.	Mangkono uga bab kurban, tapa lan dana.
The same is true of H+positive hydrogen ions.	Mangkono uga ing ion hidrogen positif H+.
The same is true of the body of this bearer.	Mangkono uga tumrap badan wadhag iki.
Thus, the flow of traffic will be faster. 	Mangkono, arus lalu lintas bakal luwih cepet.
The fifth season is expected to fall in October.	Mangsa kalima iku kira-kira tiba ing wulan Oktober.
Season with salt, pepper and mix.	Mangsa karo uyah, lada lan campuran.
The third or rainy season can plant corn.	Mangsa katiga utawa rendheng bisa nandur jagung.
The third or rainy season can plant corn.	Mangsa ketiga utawa rendheng bisa nandur jagung.
The winter usually takes place in the summer.	Mangsa manaké lumrahé berlangsung ing mangsa panas.
The future with cheap expensive money?	Mangsa nganggo murah larang dhuwit?
The weather is warming and the heat is not too hot.	Mangsa ngelekake lan panas ora panas banget.
His prey was killed with poison.	Mangsané dipatèni nganggo racun.
Solving the problem is also key here.	Mantunaken masalah ingkang guyub uga tombol kene.
This little bird can fly by moving backwards.	Manuk sethitik iki bisa mabur kanthi ngobahake mundur.
Humans are descended from the earth.	Manungsa asale saka lemah.
Humans then sing along.	Manungsa banjur nembang bebarengan.
What can man do to me?	Manungsa bisa manggawe apa marang aku?
What can man do to me? ”	Manungsa bisa manggawe apa marang aku?”
What can man do to me? ”	Manungsa bisa menggawé apa marang aku?”
What can man do to me? "	Manungsa bisa manggawé apa marang aku?"
What can man do to me? "	Manungsa bisa menggawé apa marang aku?"
Humans can land on the moon because of their creativity.	Manungsa bisa ndharat menyang rembulan amarga saka kreativitas.
Humans are becoming increasingly numerous.	Manungsa dadi tambah akèh.
Man is an object in human philosophy.	Manungsa dadi objek ana ing filsafat manungsa.
Man can control his passions by reason.	Manungsa bisa ngatur nafsune merga akal.
Man is given the authority to penetrate the sky.	Manungsa diwenehi wenang nembus langit.
Man is a sinner, because he does not believe in me.	Manungsa dosa, jalaran ora pretyaya marang Aku.
Man only seeks, God has the power to give.	Manungsa hamung ngu¬paya, Gusti kang wenang maringi.
Man only seeks, God has the power to give.	Manungsa hamung ngu­paya, Gusti kang wenang maringi.
Man must be able to be water.	Manungsa iku kudu bisa dadi banyu.
Humans belong to the animal kingdom, but are studied separately.	Manungsa kalebu kerajaan kewan, nanging dipelajari kanthi kapisah.
Man is the light of God. "	Manungsa iku sinarjonandoning Allah."
Man can only see the attributes of God’s work.	Manungsa mung bisa ndeleng sipat-sipat gegaweyane Gusti Allah.
Humans will never be able to change nature.	Manungsa ora bakal bisa ngowahi kodrat.
Humans will not and can protest.	Manungsa ora bakal lan bisa protes.
Humans are absolutely not the best at computer security.	Manungsa pancen ora paling apik ing keamanan komputer.
The next human being will fall under the dominion of lust.	Manungsa sabanjure bakal keblondrok ing panguwasaning hawa napsu.
More and more human beings have a selfish nature. 	Manungsa saya akeh kang nduweni sifat egois.
technology.	teknologi.
Humans are greedy and don’t care about the environment.	Manungsa saya serakah lan ora peduli karo lingkungan.
Humans are greedy and don’t care about the environment.	Manungsa saya srakah lan ora nggatekne lingkungan.
Man must keep in mind, God is the giver of fortune.	Manungsa wajib mbudidaya, Gusti ingkang paring rejeki.
Human beings have different abilities.	Manungsa siji lan sijine duweni kemampuan beda-beda.
Mankind is at fault.	Manungso iku anggone salah.
