This is based on advertising	Iki adhedhasar iklan
This was a mandate from the queen to save the queen.	Iki amanat saka ratu nggo nylametke ratu.
This is in the fiber for our creatures.	Iki ana ing serat kanggo makhluk kita.
This is a misconception and must be upheld.	Iki anggepan sing kleru lan kudu dijejegake.
This important body can be seen with magical eyes.	Iki awak penting bisa katon karo gaib mata.
This is part of knowing God and believing in him.	Iki bagéan menowo Allah lan pracaya marang.
This will vary from business to business.	Iki bakal beda-beda saka bisnis menyang bisnis.
This will be a cheap fund for early success.	Iki bakal dadi dana mirah kanggo sukses awal.
This will work in any language.	Iki bakal digunakake ing sembarang basa.
This will be revealed in the third trial.	Iki bakal dicethakake ing nyoba kaping telu.
This will be explained to you in full	Iki bakal diterangno sampeyan kanthi lengkap ing
This would be more offensive than anything.	Iki bakal luwih nyerang saka apa-apa.
This will be useful the next time you visit the same site.	Iki bakal migunani sabanjure ngunjungi situs sing padha.
This will require a higher flow rate.	Iki bakal mbutuhake tingkat aliran sing luwih dhuwur.
This will increase your chances of winning.	Iki bakal nambah kemungkinan saka menang.
This will increase the intelligence and flexibility of the script.	Iki bakal nambah kecerdasan lan keluwesan dadi naskah.
This will add space visually.	Iki bakal nambah spasi kanthi visual.
This will make engine emissions cleaner.	Iki bakal nggawe emisi mesin luwih resik.
This will make it easier to bind the allergen and remove it early.	Iki bakal nggampangake naleni alergen lan mbusak awal.
This will make the win even greater.	Iki bakal nggawe menang malah luwih.
This will create a sense of insecurity.	Iki bakal nggawe rasa ora aman.
This will make your stay more enjoyable.	Iki bakal nggawe sampeyan tetep luwih nyenengake.
This will make you confident on the big day.	Iki bakal nggawe sampeyan yakin ing dina gedhe.
This will increase the chances of winning.	Iki bakal nggedhekake tentrem menang.
This will allow to properly determine the treatment.	Iki bakal ngidini kanggo bener nemtokake perawatan.
This will show you the keywords above.	Iki bakal nuduhake tembung kunci ndhuwur.
This will alleviate some of these situations.	Iki bakal nyalekake sawetara kahanan kasebut.
This will cause you to rip.	Iki bakal nyebabake sampeyan nyuwek.
This will put you in competition.	Iki bakal nyedhiyakake sampeyan ing kompetisi.
This will provide the reality with potential greed.	Iki bakal nyedhiyakake kasunyatan kanthi kepencut potensial.
This will prevent infection of the baby during childbirth.	Iki bakal nyegah infeksi bayi nalika nglairake bayi.
This will prevent relapse and increase the effectiveness of therapy.	Iki bakal nyegah kambuh lan nambah efektifitas terapi.
This will speed up taxi time.	Iki bakal nyepetake wektu taksi.
This will save you lots of time and money.	Iki bakal nyimpen persil wektu lan dhuwit.
This will mean making it every month.	Iki bakal tegese nggawe saben wulan saben wulan.
This will then include all religions ”.	Iki banjur bakal nyakup kabèh agama ".
This then leads to another, important aspect.	Iki banjur nyebabake aspek liya, penting.
This is along with the increasing intensity of the rainy season.	Iki barengan karo intensitas musim udan sing ningkat.
These can be glucose, fructose, maltose or sucrose.	Iki bisa dadi glukosa, fruktosa, maltosa utawa sukrosa.
This can be a temporary use or a permanent system.	Iki bisa dadi panggunaan sementara utawa sistem permanen.
This could be an incredible winter date!	Iki bisa dadi tanggal mangsa sing luar biasa!
This can be a means of sales training.	Iki bisa dadi srana latihan dodolan.
This can be really annoying.	Iki bisa dadi tenan ngganggu.
These can be configured according to different needs through clusters.	Iki bisa diatur miturut kabutuhan beda liwat kluster.
This can be done in two ways.	Iki bisa dilakoni kanthi rong cara.
These can be taken as a liquid, orally or in capsules.	Iki bisa dijupuk minangka cairan, oral utawa kapsul.
This can be done carefully or with a telescope.	Iki bisa diterusake kanthi teliti utawa kanthi teleskop.
These can be downloaded on phones and tablets.	Iki bisa diundhuh ing telpon lan tablet.
This can be deduced from the geographical area.	Iki bisa katitik saka geografis wilayah.
This can happen literally or figuratively.	Iki bisa kedadeyan secara harfiah utawa kanthi figuratif.
This can help you earn money.	Iki bisa mbantu entuk dhuwit.
This may take a while, so don’t close it.	Iki bisa mbutuhake wektu sedhelok, dadi aja ditutup.
This can increase privacy and protect assets.	Iki bisa nambah privasi lan nglindhungi aset.
This can explain any medical problem.	Iki bisa nerangake apa wae masalah medis.
This can lead to a temporary nausea threshold.	Iki bisa nganti tekan ambang loya sementara.
This can change at any time.	Iki bisa ngganti ing sembarang wektu.
This can make you lose thousands of dollars as well.	Iki bisa nggawe ilang ewu dolar uga.
This can make the flight more enjoyable.	Iki bisa nggawe pesawat luwih nyenengake.
This can make or break. 	Iki bisa nggawe utawa nggawe.
This can make or break.	Iki bisa nggawe utawa nggawe.
This can be connected with the left hand.	Iki bisa nyambung karo tangan kiwa.
This can lead to high blood pressure.	Iki bisa nyebabake tekanan getih dhuwur.
This can lead people to creative design.	Iki bisa nyilakakaké wong desain kreatif.
This could not be more appropriate.	Iki bisa ora luwih cocok.
This can be done in a number of ways.	Iki bisa rampung ing sawetara cara.
This can be done in three ways.	Iki bisa rampung kanthi telung cara.
This may increase your chances of having a seizure.	Iki bisa uga nambah kemungkinan sampeyan ngalami sawan.
This is when they are not expected to offer items.	Iki bèn ora disangka arep nawakké barang.
This is a big flaw in terms of landing distance.	Iki cacat gedhe babagan jarak pendaratan.
This is a wonderful way to teach!	Iki cara mulang sing apik banget!
This is how we say the work of ants,…	Iki carane kita ngomong karya saka semut,…
This is very suitable for hair care.	Iki cocok banget kanggo perawatan rambut.
This I do to save money.	Iki dak lakokake supaya bisa ngirit.
This is fundamental with members of the church of Christ.	Iki dhasar karo anggota gereja Kristus.
This was suffered with serious injuries.	Iki dialami kanthi ciloko serius.
It works first as a nasal decongestant.	Iki dianggo pisanan minangka dekongestan hidung.
This is called magic, or the like.	Iki diarani tenung, utawa kaya.
This is required in order to open an account.	Iki dibutuhake supaya bisa mbukak akun.
This works at every concert.	Iki dienggo ing saben konser.
This is pictured below as a sign.	Iki digambarke ing ngisor iki minangka tandha.
This made my son determined to leave the club ”.	Iki digawe anakku ditemtokake kanggo ninggalake klub ".
These were created by politicians, ideologists, sociologists with a purpose.	Iki digawé dening politisi, ideolog, sosiolog kanthi tujuan.
It is used for clothes and shoes.	Iki digunakake kanggo sandhangan lan sepatu.
This is used when antibacterial and antifungal therapies fail.	Iki digunakake nalika terapi antibakteri lan antijamur gagal.
This was eliminated in the first round of the squad.	Iki diilangi ing babak kapisan skuad.
This is known as the Commission.	Iki dikenal minangka Komisi.
This is known as a fat building hormone.	Iki dikenal minangka hormon bangunan lemak.
These are equipped with gasoline or electric motors.	Iki dilengkapi motor bensin utawa listrik.
This is designed as lion proof.	Iki dirancang minangka bukti singa.
It is designed as a tower type bridge.	Iki dirancang minangka jembatan tipe menara.
These are linked to other websites and blogs.	Iki disambung karo situs web lan blog liyane.
This is explained in more detail below.	Iki diterangna kanthi luwih rinci ing ngisor iki.
It is transmitted sexually and domestically.	Iki ditularake kanthi cara seksual lan domestik.
It is given by injection into the skin.	Iki diwenehi dening injeksi ing kulit .
This is a fairy tale based on a child.	Iki dongengan panunggalane dhêdhasar bocah.
It has to do with an authority or power.	Iki gegayutan karo satunggaling panguwasa utawa kekuasaan.
This depends on individual taste.	Iki gumantung saka rasa individu.
This is where he dreamed of starting his career.	Iki ing ngendi dheweke ngimpi wiwit kariré.
This substance helps increase the metabolic rate of one.	Iki inti mbiyantu Tambah ing metabolis tarif siji.
This comes off as weird, scary and desperate.	Iki isa mati minangka aneh, serem lan nekat.
This is a complex issue.	Iki jeksa agung bisa ngetokake komplek.
This will all be able to improve your foundation.	Iki kabeh bakal bisa nambah dhasar sampeyan.
This is all a shared responsibility.	Iki kabeh dadi tanggung jawabe bebarengan.
This is what will make us often hungry.	Iki kang bakal ndadekake kita kerep ngelih.
This happened when he saw his brother’s career.	Iki kedadean nalika dheweke nyumurupi karier kakange.
This should be considered a purchase.	Iki kudu dianggep minangka tuku.
This should be used only when needed.	Iki kudu digunakke mung nalika dibutuhake.
This should make protecting your assets a priority.	Iki kudu nggawe nglindhungi aset sampeyan minangka prioritas.
This is a good enough guide.	Iki lho pituduh kang cukup.
This holiday opens with performances of queens and presidents.	Iki liburan mbukak karo kinerja ratu lan presiden.
This is better than treating anything.	Iki luwih becik tinimbang nambani apa-apa.
It is located in a safe area when it is installed.	Iki mapan ing wewengkon kang aman nalika diyasa.
This limits who has access to the report.	Iki mbatesi sing nduweni akses menyang laporan kasebut.
This provides a way to develop the logistics sector.	Iki menehi cara kanggo ngembangake sektor logistik.
This will definitely help satisfy your wealth.	Iki mesthi bakal bantuan gawe marem kasugihan Panjenengan.
This is the reason people choose to keep doll images.	Iki minangka alasan wong milih nyimpen gambar boneka.
This is an easy -to -use tool for users.	Iki minangka alat sing gampang dianggo pengguna.
This is the main square of the old town.	Iki minangka alun-alun utama kutha lawas.
It is an antiseptic and disinfectant.	Iki minangka antiseptik lan disinfektan.
This is an affiliate section of this store.	Iki minangka bagean afiliasi saka toko iki.
This is the dilemma of classic innovators.	Iki minangka dilema para inovator klasik.
This is a good example for my photo shoot.	Iki minangka conto sing apik kanggo gambar fotoku.
This is a very convenient feature!	Iki minangka fitur banget trep!
This is the highest waterfall in the Czech Republic.	Iki minangka grojogan paling dhuwur ing Republik Ceko.
This is a practitioner type of technical analysis.	Iki minangka jinis praktisi saka analisis teknis.
This is a great treasure for book lovers.	Iki minangka kasugihan gedhe kanggo para penyayang buku.
This is the name of the German language.	Iki minangka jenenge basa Jerman.
This is a serious mistake that increases age.	Iki minangka kesalahan serius sing nambah umur.
This is an unlawful practice.	Iki minangka laku sing haram.
This is a viral move.	Iki minangka pamindhahan virus.
These are brokers, which we have to officially monitor.	Iki minangka makelar, sing kita kudu ngawasi resmi.
This is the seat of parliament and the president.	Iki minangka panggonan parlemen lan presiden.
This is the most popular place to stay.	Iki minangka panggonan sing paling populer kanggo tinggal.
This is another exception that proves the rule.	Iki minangka pangecualian liyane sing mbuktekake aturan kasebut.
This is where it can be found in design.	Iki minangka panggonan sing bisa ditemokake ing desain.
This is a scene that can be done in full.	Iki minangka pemandangan sing bisa ditindakake kanthi lengkap.
This is the opinion of the Council of Europe in particular.	Iki minangka pendapat saka Dewan Eropa utamane.
These are real fighters for Peace!	Iki minangka pejuang nyata kanggo Damai!
This is an important essential tool.	Iki minangka perangkat penting sing penting.
This is an excellent choice for a family vacation.	Iki minangka pilihan banget kanggo liburan kulawarga.
This is the most common lens choice.	Iki minangka pilihan lensa paling umum.
These are the multiple stages of the menstrual cycle.	Iki minangka pira-pira tahap kaping siklus menstruasi.
This was the first choice of the metal industry procession.	Iki minangka pilihan pertama saka prosesi industri logam.
This is a symbol that the baby	Iki minangka pralambang menawa si bayi
This is a procedure.	Iki minangka prosedur.
This is a surgical procedure.	Iki minangka prosedur bedhah.
This is one of the main symptoms of the disease.	Iki minangka salah sijine gejala utama penyakit.
This is one of my favorite pieces of art.	Iki minangka salah sawijining potongan seni favorit.
These are some of the key features of a home security system.	Iki minangka sawetara fitur utama sistem keamanan omah.
This is a common sentiment in government.	Iki minangka sentimen umum ing pamaréntahan.
This is a human attitude, actually.	Iki minangka sikap manungsa, sejatine.
This is a symbol of strength and power.	Iki minangka simbol kekuatan lan kekuwatan.
This is a substance called carbon.	Iki minangka substansi sing diarani karbon.
This is the oldest theater in Slovakia.	Iki minangka teater paling tuwa ing Slowakia.
This is a solid spot.	Iki minangka titik padhet.
This is a huge task, but I’m done.	Iki minangka tugas ageng, nanging aku wis rampung.
This is a measure of changes in the cost of goods and services.	Iki minangka ukuran owah-owahan biaya barang lan layanan.
This is the act of selling a currency pair.	Iki minangka tumindak sade pasangan mata uang.
This is an irrevocable law.	Iki minangka ukum sing ora bisa diganti.
This is the last revised version.	Iki minangka versi pungkasan sing direvisi.
This is a time when his future and career are in question.	Iki minangka wancine masa depan lan kariré ditakokake.
This is a small time of the porn industry.	Iki minangka wektu cilik saka industri porno.
These are time-suckers.	Iki minangka wektu-suckers.
This is our mission and our resources.	Iki misi kita lan sumber daya kita.
This is man’s relationship with the Lord.	Iki mujudake hubungane manungsa karo Pangeran.
This challenged and undermined the power of the European monarchy.	Iki nantang lan ngrusak kekuwatan monarki monarki Eropa.
This makes this type of dating unique.	Iki ndadekake jinis iki saka Gendakan unik.
This is the biggest negative of use.	Iki negatif paling gedhe nggunakake.
This results in heavy fines or even imprisonment.	Iki ngetokake denda abot utawa malah di penjara.
This makes her cold and insensitive.	Iki nggawe dheweke kadhemen lan ora sensitif.
This creates an optical illusion in the room.	Iki nggawe ilusi optik ing kamar.
This sends things more complex.	Iki ngirim perkara sing luwih kompleks.
This measures the material and size of the soil.	Iki ngukur materi lan ukuran ing lemah.
This left the family in great happiness.	Iki ninggalake kulawarga ing kebahagiaan gedhe.
This leaves can be no more than four weeks.	Iki ninggalake ora bisa luwih saka patang minggu.
This took me fresh thoughts about leaving the United States.	Iki njupuk pikirane seger babagan ninggalake Amerika Serikat.
This shows that the creature is not a mummy.	Iki nuduhake yen makhluk kasebut dudu mumi.
This caused many to see it as shocking.	Iki nyebabake akeh sing weruh minangka gawe kaget.
This causes the accumulation of oil under the skin.	Iki nyebabake akumulasi lenga ing ngisor kulit.
This earned him the nickname ‘Spiderman Boateng’.	Iki nyebabake dheweke 'Spiderman Boateng' julukan.
This provides a relatively low chance of side effects.	Iki nyedhiyakake kasempatan efek samping sing relatif murah.
It penetrates into the epithelium and conjunctiva of the cornea.	Iki nyerepake menyang epitelium lan konjungtiva kornea.
This is a real oasis in the middle of a busy city.	Iki oase nyata ing tengah-tengah kutha sing sibuk.
This does not mean that the stone is genuine or synthetic.	Iki ora ateges watu sing asli utawa sintetis.
This will not disqualify you from the contest.	Iki ora bakal mbatalake sampeyan saka kontes.
This is unworkable and unusual.	Iki ora bisa ditindakake lan ora biasa.
This cannot be forgotten through this.	Iki ora bisa dilalekake liwat iki.
This cannot be offered by the psychic.	Iki ora bisa ditawarake kanthi psikik.
This could not be further from the truth.	Iki ora bisa luwih saka bebener.
These are not all indications for the use of these drugs.	Iki ora kabeh indikasi kanggo nggunakake obat kasebut.
This does not include some.	Iki ora kalebu sawetara.
This would not happen without this having consequences!	Iki ora kelakon tanpa iki gadhah jalaran!
These are not necessarily interrelated.	Iki ora kudu saling gegandhèngan.
This is not necessarily an enemy or a known foe.	Iki ora mesthi mungsuh utawa mungsuh sing dikenal.
This is not just about the time or the day of the week.	Iki ora mung babagan wektu utawa dina minggu.
This is not a life or death situation here.	Iki ora urip utawa pati kahanan kene.
Receive them in remembrance of me. "	Iki padha tampanana minangka pengéling-éling marang Aku."
Take this in remembrance of me. ”	Iki padha tampanana minangka pengéling-éling marang Aku.”
This will most definitely be double as a historical date!	Iki paling temtunipun bakal pindho minangka tanggal sajarah!
This is important, so that we can identify the account.	Iki penting, supaya kita bisa ngenali akun.
This is literally the coolest thing for me!	Iki secara harfiah sing paling adhem kanggo aku!
This is why you can find it. 	Iki sebabe sampeyan bisa nggoleki.
image source	sumber gambar
This is why you should use a tattoo specialist.	Iki sebabe sampeyan kudu nggunakake spesialis tato.
Is this a casual kick-in boyfriend, or a serious boyfriend?	Iki sembrono kick-iku pacar, utawa serius pacar?
This is what is called “black science”.	Iki sing disebutake "ngelmu ireng".
This is an international system for communication between banks.	Iki sistem internasional kanggo komunikasi antarane bank-bank.
This is so called hypnosis, or the like.	Iki supaya disebut hipnosis, utawa kaya.
This is so that it does not necessarily affect the quality of the network connection.	Iki supaya ora kudu ngetrapake kualitas sambungan jaringan.
This means that regulation is important.	Iki tegese angger-angger iku penting.
This means it is not exempt from overtime pay.	Iki tegese ora dikecualake saka bayaran lembur.
Do this in remembrance of me. "	Iki tindakna minangka pangéling-éling marang Aku."
Do this in remembrance of me. "	Iki tindakna minangka pengéling-éling marang Aku."
Do this in remembrance of me. ”	Iki tindakna minangka pengéling-éling marang Aku.”
This task cannot be accomplished with ordinary ability.	Iki tugas ora bisa kawujud kanthi kemampuan biasa.
This can also be used in alternatives.	Iki uga bisa digunakake ing alternatif.
This can also be severely tortured by search engines.	Iki uga bisa disiksa banget dening mesin telusur.
This can also accompany you on the road.	Iki uga bisa ngiringi sampeyan ing dalan.
This is also the case with male names.	Iki uga kasus karo jeneng lanang.
This is also a treatment for low appetite.	Iki uga minangka perawatan kanggo napsu kurang.
This also improves information recall.	Iki uga mbenakake kelingan informasi.
This is also very helpful for copyright issues.	Iki uga nulungi banget kanggo masalah hak cipta.
This is commonly used as a classification.	Iki umume digunakake minangka klasifikasi.
This is an invitation for you.	Iki undangan kanggo panjenengan.
This is especially important when it comes to a mate’s faith.	Iki utamané penting nalika nerangake iman mate.
This saw a return to his training career.	Iki weruh bali menyang karir latihan.
This has raised concerns among biologists.	Iki wis marakaké prihatin para biologiwan.
This is done by hand.	Iki wis rampung kanthi tangan.
This, of course makes the user very friendly.	Iki, mesthi ndadekake pangguna banget.
Advertising can make money blogging.	Iklan bisa nggawe dhuwit blog.
These ads help others, while earning money.	Iklan iki mbantu wong liya, nalika entuk dhuwit.
Advertising plays a big role in the success of every business.	Iklan nduweni peran gedhe kanggo sukses saben bisnis.
Ads that aim to offer a good or product. 	Iklan ingkang ancasipun nawakaken barang utawa produk.
It’s a place the Christmas magic can be experienced year round.	Iku Panggonan Piandel Natal bisa ngalami babak taun.
It’s this job portal to know how to make progress.	Iku Warta proyek iki ngerti carane nggawe kemajuan.
It is based on the glory of the calling itself.	Iku adhedhasar kamulyaning panggilan dhewe.
It is a reliable and comprehensive tool.	Iku alat sing dipercaya lan komprehensif.
It is an attack on what God has created.	Iku anggempur ing apa wis digawé Gusti Allah.
It’s what’s underneath all of this happening what’s important.	Iku apa ngisor kabeh iki kedadean apa penting.
It is because you cannot listen to my words.	Iku awit kowe padha ora bisa nyandhak pituturKu.
It’s about providing useful information.	Iku babagan nyedhiyakake informasi migunani.
It’s going to be about ‘Sea Eagle’.	Iku bakal dadi babagan 'Laut Eagle'.
It will be included in the scope.	Iku bakal katalibaké ing wengku.
It will make us fall in our faces.	Iku bakal nggawe kita tiba ing pasuryan kita.
It will record maintenance on the aircraft, etc.	Iku bakal ngrekam pangopènan ing pesawat, dll.
It will make sense in the end.	Iku bakal nggawe raos ing pungkasan.
It will provide the contents of the button at a glance.	Iku bakal nyedhiyani isi tombol ing Mirit.
It will come in a whole lot of other countries.	Iku bakal teka ing akèh kabèh negara liya.
It is very well connected with the main Italian centers.	Iku banget sarta disambungake karo pusat Italia utama.
It is very convenient and can be easily stored.	Iku banget trep lan bisa gampang disimpen.
Then they went up to Jerusalem.	Iku banjur padha tindak menyang ing Yerusalem.
It’s nice to stay away from negative comments.	Iku becik kanggo tetep adoh saka komentar negatif.
It’s true of both employers and employees.	Iku bener saka loro juragan lan karyawan.
It is usually associated with fall.	Iku biasane sing digandhengake karo tiba.
It can be seen on the table, the photographer said	Iku bisa dideleng ing tabel, tembung fotografer
It could be as a friend or as a potential boyfriend,…	Iku bisa minangka kanca utawa minangka potensial pacar,…
It could be as a friend or as a potential…	Iku bisa minangka kanca utawa minangka potensial…
It’s small so I can’t find it.	Iku cilik supaya aku ora bisa nemokake iku.
It is a sorcerer and a false prophet.	Iku dadi tukang sihir lan nabi palsu.
He is a sorcerer and a false prophet,	Iku dadi tukang sikir lan nabi palsu,
It is by far the easiest and best way!	Iku dening adoh cara paling gampang lan paling!
It was made in the hands of the musicians themselves.	Iku digawe ing tangan musisi piyambak.
It is found to be a generic drug.	Iku ditemokake minangka obat generik.
It is not a paper stock or a physical commodity.	Iku dudu saham kertas utawa komoditas fisik.
It’s easy to work with our system.	Iku gampang kanggo bisa karo sistem kita.
It is very easy to use and configure.	Iku gampang banget kanggo nggunakake lan konfigurasi.
It’s easy to make friends here.	Iku gampang kanggo nggawe kanca-kanca ing kene.
It is God’s gift and action in us.	Iku hadiah lan tumindak Allah ing kita.
It was clear he wanted to make his father proud.	Iku jelas dheweke pengin nggawe bapake bangga.
It’s all about channeling resistance from the community.	Iku kabeh babagan nyalurake resistensi saka masyarakat.
It all depends on the strength of the individual body.	Iku kabeh gumantung saka kekuatan awak individu.
It all depends on what you can make the tattoo.	Iku kabeh gumantung apa sing bisa nggawe tato.
It all depends on what he does.	Iku kabeh gumantung marang apa kang ditindakake.
It all depends on the experience of the candidate.	Iku kabeh gumantung saka pengalaman calon.
It had an impressive design and insight.	Iku kagungan rancangan nyengsemaken lan wawasan.
It is a condition that exists in our bodies.	Iku kahanan kang ana ing badan kita.
It was his event then I would be successful.	Iku kang acara banjur aku bakal sukses.
It’s his event and I’m going to be successful.	Iku kang acara lan aku bakal sukses.
It includes statistics on payments.	Iku kalebu statistik ing pembayaran.
It’s his line as a defense mechanism.	Iku kang baris minangka mekanisme pertahanan.
That's something that needs to be studied more deeply. ”	Iku kang perlu ditaliti luwih jero.”
It's a real combine!	Iku kang nyata gabungke!
It’s to get the point right.	Iku kanggo njaluk titik tengen.
It was the best decision I ever made in my life.	Iku kaputusan paling aku tau digawe ing urip.
It’s called the conquerors of the past.	Iku kasebuté para digdaya ing jaman biyèn.
It’s like he knows where the fruit is. 	Iku kaya dheweke ngerti ngendi woh iku.
It’s a huge step forward.	Iku langkah gedhe banget.
It’s easier this way	Iku luwih gampang nganggo cara iki
It depends on the rules of the United States and the congregation.	Iku mau gumantung karo aturaning Sarékat lan kongregasi.
It brings a sense of excitement.	Iku mau ndadekke rasa bungah.
It helps a lot in my life and work.	Iku mbantu akeh ing urip lan karya.
It helped me charge the battery so to speak.	Iku mbantu aku ngisi batre supaya bisa ngomong.
It helps nicely from the first application.	Iku mbantu becik saka aplikasi pisanan.
It helps strengthen and restore hair.	Iku mbantu ngiyatake lan mulihake rambut.
