Ivan Gunawan has also been a commentator on reality shows	Ivan Gunawan uga tau dadi komentator ning acara realiti show
The ability to move rapidly also attracts the attention of scientists.	Kamampuan obah kanthi rikat uga narik kawigatèn èlmuwan.
Baguazhang is a martial science that is considered new.	Baguazhang ya iku ngèlmu bela diri kang dianggep anyar.
All prizes are in pounds sterling.	Kabèh bebungah dhuwit sajeroning dhuwit pound sterling.
Clover is usually eaten with crackers with spices.	Semanggi lumrahé dipangan nganggo krupuk karo bumbu.
When making pecel, clover leaves are usually seasoned with spicy spices.	Nalika digawé pecel, godhong semanggi lumrahé diwénéhi bumbu pedhes.
International standard bowling facilities for 60 tracks	Fasilitas ulah raga bowling taraf internasional kanggo 60 lintasan
Anggang-anggang is a kind of grumpy animal that lives in water.	Anggang-anggang ya iku jinisé kéwan gegremet kang uripé ana banyu.
Opick, in addition to being a religious singer, he also composed songs.	Opick, saliyané dadi penyanyi religi, dhèwèké uga nyipta tetembangan.
Quotes by Raihan:	Tetembangan kang digawakaké déning Raihan :
In the junior category, all single championships were won by participants from Australia.	Ing kategori junior, kabèh juwara tunggal diraih peserta asal Australia.
Limas is basically a square that can be called a pyramid.	Limas kanthi dhasar ya iku pesagi bisa uga diarani piramida.
He admits it and feels he has no talent in that regard.	Dhèwèké ngakuni lan ngrasa ora duwé bakat ning babagan mau.
The life of this beautiful kenya had become the stuff of news.	Kauripané kenya ayu iki sempet dadi bahan pamberitaan.
However, he is not satisfied with what he is getting now.	Nanging, dhèwèké durung puas maring apa kang diolihi saiki.
However, the sulfur in chives is not as much as onions.	Sanajan ngono, sulfur kang ana ing kucai ora saakeh bawang.
Both of them, it seems increasingly serious to do it together.	Sakloron, katon tambah serius anggoné nglakoni bebarengan.
Other albums ever released with the band Gigi:	Album liyané kang tau dirilis bebarengan karo grup band Gigi:
Jenifer herself did not deny the affection she had for her lawyer.	Jenifer dhéwé ora mbantah rasa sayang kang diduwèni marang pangacarané.
Chiko also thinks that he is as popular as he is now.	Chiko uga nyangka yèn dhèwèké dadi populèr kaya saiki.
Because bored with the world of music.	Amarga bosen karo donya musik.
Ariel also experimented with the world of acting, through her role on the big screen.	Ariel uga nyoba donya akting, lewat peranné ing layar amba.
Often playing on the big screen, it makes him bored.	Sering main ning layar lebar, anggawe dhèwèké bosen.
The problem is, they both don't accept it and blame each other.	Masalahé, sakloron ora terima lan pada nyalahaké.
However, his face began to rarely appear on television shows.	Nanging, wajahé wiwit jarang katon ning acara-acara televisi.
Poppy is rumored to have been living with Mandala without a marriage bond.	Poppy dikabaraké wis nggomah bareng karo Mandala tanpa ikatan nikahan.
Indy is famous as a radio host and broadcaster in Jakarta.	Indy kawentar minangka pambyawara lan penyiar radio ing Jakarta.
The film is a testament to Edric's quality of acting.	Film kang dadi pambuktian Edric ning babagan kualitas aktingé.
His singles or mini -albums are handled by him and Pay.	Album single utawa mini albumé diurus déning dhèwèké lan Pay.
Poppy’s love life is also quite interesting.	Kauripan asmarané Poppy uga lumayan menarik.
The soap opera once starred the second of four children	Sinetron kang tau dibintangi anak kaping loro saka anak papat
So that his activities in the world of music do not interfere with contract matters.	Supaya aktifitasé ning dunya musik ora keganggu karo urusan kontrak.
His first season idol and his second season as well.	Idol mangsa pisanan lan musin kang kaping loroné uga.
The wedding feast was to be sacred and merry.	Pista nikahan iku dadi sakral lan meriyah.
He has a penchant for collecting glasses.	Dhèwèké duwé karemenan ngoleksi kacamata.
This book contains the story of his backpacking travels in other countries.	Buku iki isiné kisah parjalannan backpackingé ning nagara-nagara liyané.
In addition to being a songwriter,	Saliyané dadi kang ngréka lagu,
He was skeptical of ever appearing with hot scenes.	Dhèwèké mamang sok tampil karo adegan-adegan panas.
The dowry at the wedding was, a set of prayer utensils, and jewelry.	Mahar nalika nikah ya iku, saperangkat paralatan salat, lan perhiasan.
Uya herself has been bringing reality shows since 2003.	Uya dhéwé wis nggawa acara reality show awit taun 2003.
Winehouse has plans to write lyrics for his latest album.	Winehouse duwé rencana nulis tetembangan kanggo albumé kang paling anyar.
Anjasmara was once sued by a religious mass organization.	Anjasmara tau dituntut déning sawijining organisasi massa kaagaman.
Even so, the soap opera continues to run until the end story.	Meski ngono sinétron mau tetep mlaku hingga carita akir.
He already had two children, the first of whom was named	Dhèwèké wus duwé anak loro, anak kang pisanan dijenengi
Olivia began her career as a model in a teen magazine.	Olivia wiwit karir dadi model ning majalah rumaja.
Then spread its wings by starring in a soap opera.	Banjur melebarkan sayap karo mbintangi sinétron.
And they don’t yet have the desire to momong a child.	Lan durung duwé pepenginan kanggo momong anak.
Now the lives of the younger generation are irregular, less organized.	Saiki uripé génerasi mudha ora teratur, kurang olaraga.
Only family and close people are invited.	Namung kulawarga lan wong-wong cedhak kang diundhang.
Sheila and her friends were arrested for using cannabis.	Sheila karo kanca-kancané ditangkap amarga nganggo sabu-sabu.
As of 2009, there have been two films starring.	Ning taun 2009, wis ana rong filem kang diperanaké.
Because he will be an example to many teenagers in Indonesia.	Amarga dhèwèké bakal dadi contoh para rumaja akèh ning Indonésia.
The judge ruled he was sentenced to one year in prison and fined Rp5 million.	Hakim mutusaké dhèwèké divonis sataun kunjara lan denda Rp5 yuta.
Her acting debut began when she starred in acting	Debut aktingé diawali nalika dhèwèké main akting dadi
But it came out before his second album was released.	Nanging metu sadurungé album kang kaping loroné dirilis.
A peace campaign aimed at the community.	Kampanyé perdamaian kang ditujukaké kanggo masarakat.
From the theater he began to penetrate the big screen.	Saka teater dhèwèké wiwit merambah ning layar lebar.
Cici was born into a family that loved music.	Cici lair ing kulawarga kang seneng musik.
Cucumbers are nutmeg kesimpar, the color is slightly greenish white.	Timun kagolong pala kesimpar, wernané ijo rada putih.
The tree crept up and down, with its fine hairs running downwards.	Wité mrambat lan ngubet, kanthi rambut-rambut alus kang anuju mengisor.
She loved to dance since childhood, when she was 9 years old.	Dhèwèké seneng marang jogèd wiwit cilik, nalika umur 9 taun.
The first hyacinth was discovered by accident	Enceng gondok pisanan tinemu kanthi ora sengaja déning
The veil or veil is now very popular with people.	Kudhung utawa kerudung ing jaman sapunika sampun kathah diremeni tiyang.
Development of screening to determine the degree and accumulation of disease.	Perkembangan pamriksan kanggo nemtokaké drajat lan pangumpulan lelara.
A hole in which there is a nematocyst may have exposed the bark to its enemies.	Bolongan kang ana nematosista bisa uga ngetokaké upas kanggo musuhé.
Morse passwords are used in all countries with the same rules.	Sandhi morse dinggo ing kabèh nagara kanthi aturan kang padha.
Below the mouth is a throat sometimes called the stomodeum.	Sakngisoré cangkem ana krongkongan sok diarani stomodeum.
The dead laron can be fried and used as fish feed.	Laron kang wis mati bisa digorèng lan dianggo pakan iwak.
Conservation also has the meaning of protecting and preserving.	Konservasi uga nduwé teges njaga lan nglestarékaké.
Kawis can be processed into syrup and lemonade.	Kawis bisa diolah dadi sirup lan limun.
According to environmental science, the word conservation has a meaning.	Miturut ngèlmu lingkungan,tembung konservasi nduwé teges.
A collection of photos at the close of a four -limpad project	Kumpulan foto ing panutupan proyek papat limpad
In addition to decorating this plant is also for polo cancer medicine.	Saliyané kanggo dékorasi tuwuhan iki uga kanggo obat kanker polo.
How to remove pigeon orchids from bottles in pots.	Carané kanggo mindahaké anggrèk merpati saka gendul ing pot.
Index fossils are fossils which are indicative of geological time.	Fosil indek iku fosil kang minangka nuduhaké wektu géologi.
Efforts to cultivate this ornamental plant continue to flourish.	Usaha kanggo ngrembakaké tuwuhan hias iki terus ngrembaka.
Pigeon orchids can easily be removed from the empolé.	Anggrèk merpati kanthi gampang bisa dibedhol saka empolé.
Pigeon orchids can be bred or bred.	Anggrèk merpati bisa ditengkaraké utawa digawé anakan.
The history of warteg can be traced from various versions.	Sajarah warteg saged dipunruntut saking manéka versi.
What makes orchids last forever is that.	Kang ndadèkaké anggrèk tetep langgeng ya iku.
There are ways to make this flower bloom.	Ana cara kanggo nggawé kembang iki ngembang.
Cuprolite is a fossil that forms animal droppings.	Cuprolit iku fosil kang wujud telek kéwan.
Pigeon orchids are tropical plants.	Anggrèk merpati kalebu tuwuhan tropis.
To plant in a pot requires tools.	Kanggo nandur ing pot dibutuhaké piranti-piranti.
Weeds include plants that work for medicine.	Alang-alang kalebu tuwuhan kang bisa kanggo obat.
Barriers to purulent bladder pain medication.	Alang-alang kanggo obat lelara nguyuh nanah.
This type of fossil has not changed, remaining as it was in its original form.	Jinis fosil iki ora ana owah-owahane, tetep kaya wujud awalé.
Hence many call it dragon fish or dragon fish.	Mula akèh kang ngarani dragon fish utawa iwak naga.
Range seeds can be eaten directly or cooked.	Wiji jéngkol bisa dipangan langsung utawa dimasak.
Caustic acid can also cause constipation.	Asam jéngkolat uga bisa njalari wurung.
The range actually has a lot of benefits.	Jéngkol nyatané duwé manfaat kang akèh.
The acidic content of the seeds in the seeds is varied.	Kandhutan asem jéngkolat kang ana ing wiji jéngkol warna-warna.
Add the coconut milk and add the sliced ​​spices.	Umebna santen banjur lebokna bumbu-bumbu kang wis diiris.
Signs of a person who lacks antioxidants in the body are:	Tanda-tanda wong kang kurang antioksidan ing awake yaiku:
Prior to this, the tourist attraction was a shower (beji).	Sadurungé dadi owabong, objèk wisata iki awujud padusan (bèji).
The disadvantage of this coast is that it is not well managed by the government.	Kakuranganing pasisir iki ya iku durung dikelola apik déning pamaréntah.
In addition, clouds are also differentiated according to the temperature of the physical environment of the atmosphere.	Saliyané iku méga uga dibédakaké manut suhu lingkungan fisik atmosfer.
The heirloom of tayuhan is one of the kris according to its manufacture.	Pusaka tayuhan punika salah sawijining keris miturut pandamelipun.
The word angkringan is derived from the term nangkring or hanging.	Tembung angkringan dijupuk saka istilah nangkring utawa nongkrong.
The benefits of this plant have been widely felt in various countries.	Mupangat saka tuwuhan iki wis akèh dirasakaké ing manéka nagara.
Based on this incident then panakawan became a guardian and a witness.	Adhedasar kadadéan iki banjur panakawan dadi pamomong lan seksi.
A shoe is a pad or item that serves as a foot pad.	Sepatu yaiku lapik utawa barang kang minangka buntél sikil.
In fact, children with autism can be treated.	Sajatiné bocah kang nandang autis iku bisa ditambani.
Its efficacy is not just as a smooth digestion only.	Khasiaté ora mung minangka palancar pancernan waé.
Gareng has the meaning of worship or aleh from worship.	Gareng duwé teges pujaan utawa aleh saka muja.
The leaves are green with a grayish margin.	Godhongé ijo kanthi pinggirian mawa grigi.
Combro is a food made from cloth.	Combro iku panganan kang digawé saka tela.
How to maintain shoes according to the material of the shoes.	Cara ngrumat sepatu manut bahan sepatu.
There are several points to distinguish between male and female lobster:	Ana sapirang titikan kanggo mbédakaké lobster lanang lan lobster wadon:
The wind is really invisible but the wind can be measured.	Angin pancèn ora bisa disawang nanging angin bisa diukur.
The disease that attacks the pacé tree is the leaf rickshaw.	Lelara kang nyerang wit pacé iku becak godhong.
Naturally, the winds are considered to be local winds and winter winds.	Lumrahé, angin kapantha dadi angin lokal lan angin mangsa.
In everyday language, the term “moss” can mean several divisions.	Sajeroning basa sadina-dina, istilah "lumut" bisa tegesé sawatara divisio.
Sour candies are still around the family with mangosteen and sour gelugur	Asem kandis isih sak kulawarga karo manggis lan asem gelugur
Kaka usually plays in the position of the attacking gland or striker.	Kaká padatan main ing posisi glandhang serang utawa penyerang.
Moho is a type of food made from rice flour.	Moho iku jènising panganan kang digawé saka glepung beras.
Plorotan is a children's toy that is usually found in the park.	Plorotan iku dolanan bocah sing biyasa tinemu ing taman.
Turkeys have a strange interest in performing marriages.	Kalkun duwé kapinteran kang aneh ing nglakoni kekawinan.
The fishplate is between 2 connected rails	Fishplate ing antarané 2 ril kang disambung
In 2011, before his film was released, his soundtrack had become a favorite.	Ning taun 2011, sadurungé filemé dirilis, soundtrack-e wis dadi favorit.
When he had a car accident in 2006,	Nalika ngalami kacilakan mobil ing taun 2006,
Afterwards the same record company grabbed Yui's contract.	Sesampunipun punika perusahaan rekaman sami rerebutan ngontrak Yui.
He was also invited to Japan to promote the drama.	Dhèwèké uga diundhang menyang Jepang kanggo mromosikaké drama mau.
It is the most representative region in Cartagena.	Arupa wewengkon sing paling representatif ing Cartagena.
The Minangkabau region is made up of many countries.	Wewengkon Minangkabo kapérang saking kathah nagari.
He left his school when there was an agent	Dhèwèké ngakiri sekolahé nalika ana agen
His hard work while acting made him successful,	Usahané kang keras nalika lagi aktinng nggawé dhèwèké olih kasil,
She changed her makeup and changed her hair color to pink.	Dhèwèké ngubah dandanané lan ngubah warna rambuté dadi jambon.
Jen then immediately signed a recording contract.	Jen kang nuli langsung nanda tangani kontrak rekaman.
The incident marked the beginning of his life as an artist.	Kadadian mau dadi awal kauripané dadi artis.
Cholesterol can be made synthetically.	Kolesterol bisa digawé kanthi cara sintetik.
Peggy is also known for her social activities.	Peggy uga ditepungi kanthi aktivitas sosial.
The fur is dense and water resistant, it can be straight or wavy.	Wuluné kang rapet lan tahan banyu, bisa lurus utawa ngombak.
Others are 46 reptile colors in this national park.	Liyane ana 46 warna reptil ing taman nasional iki.
In 1993, he changed his style to develop his career.	Ing taun 1993, dhèwèké ngganti gayané kanggo ngembangaké kariré.
Kerststol which is cut and in the middle is given almond paste	Kerststol kang dipotong lan ing tengahé diwènèhi pasta almond
The film was also a prelude to his success	Film mau uga dadi pangantar suksesé mula dhèwèké
Under this company he was not allowed to create.	Ning ngisoré perusahaan iki dhèwèké ora diijinaké kanggo ngaripta.
Marty has known the international world since the age of nine.	Marty wis ngerti donyaning internasional wiwit umur sangang taun.
Prostate cancer is a cancerous disease of the prostate.	Kanker prostat ya iku lelara kanker kang ana ing prostat.
About also the privilege of a better night than there.	Babagan uga kaistimiwaan malam yang lebih baik dari ana.
The tree is native to the middle eastern region.	Wit iki asalé saka wewengkon wétan tengah.
The cause of liver cancer has not yet been fully explained.	Panyebab kanker ati|ati nganti saiki durung bisa diterangaké kanthi pener.
When made, yeot racake is made from fermented rice.	Nalika gawé, yeot racaké digawé saka beras kang difermentasekake.
The pathogenesis of lung cancer has not been correctly predicted.	Patogenesis kanker paru-paru durung bisa dibedhek kanthi bener.
Eventually his career became increasingly successful, and his name became increasingly well -known.	Akiré kariré tambah sukses, lan jenengé dadi tambah kondhang.
During his stint in the world of acting, he never chose a role.	Sasuwené njegur ning donya akting, dhèwèké ora tau pilah-pilih peran.
The father of the bride will follow you to the chair.	Bapak saka pangantin wanita bakal ngiring tekan kursi rinengga.
Not only is he well known as a kung fu master and author of books.	Ora namung kondhang dadi master kung fu lan penulis buku.
Purnomo is the eldest child of two siblings.	Purnomo iku anak pambarep saka sadulur kang cacahé loro.
Escargot is a food made from snail meat.	Escargot iku panganan kang digawé saka daging bekicot.
After that, he received many offers to hone his acting talents.	Sawisé iku, dhèwèké olih tawaran akèh kanggo ngasah bakat aktingé.
After the scandal, he still lives in his country.	Sawisé kena skandal mau, dhèwèké esih tetep manggon ning nagarané.
According to experts there are several notions of organization.	Minurut para ahli ana pirang-pirang pengertian organisasi.
Bips is an artist who doesn’t like to gonta -ganti lover.	Bips iku artis kang ora seneng gonta -ganti pacangan.
He has 2 brothers, an older sister and a younger sister.	Dhèwèké duwé 2 sadulur, kakang wadon lan adhi wadon.
Rizky Hanggono is the eldest child of two siblings.	Rizky Hanggono iku anak pambarep saka sadulur kang cacahé loro.
He is one of the most successful directors in Bollywood.	Dhèwèké iku salah sijiné sutradara sukses ing Bollywood.
There, he completed his schooling at St.	Ning kana, dhèwèké ngerampungaké sekolahé ning St.
Hsü Wei-lun started as an artist while still in college.	Hsü Wei-lun miwiti dadi artis nalika isih kuliyah.
Sultan Iskandar Muda International Board of Regents	Papan Anggegana Internasional Sultan Iskandar Muda
Its task is like tackling poverty and other social problems.	Tugasé kaya ta nanggulangi kemlaratan lan masalah sosial liyané.
His thoughts are also expressed by the philosophy of language.	Pamikiranipun ugi dipunpratélakaken kanthi filsafat basa.
Since then his career in the world of acting has become more established.	Awit iku kariré ning donya akting tambah mantep.
Sadino was born into a family of self -sufficiency.	Sadino lair saka kulawarga kang kacukupan.
But he actually started his career as an actor in 1981	Nanging dhèwèké bener-bener ngawali karir dadi aktor ning taun 1981
In 2011 he decided to venture into the world of music.	Ning taun 2011 dhèwèké mutusaké kanggo njegur ning donya musik.
Sanjay Dutt was once arrested on charges of involvement in a terrorist network.	Sanjay Dutt tau ditangkap amarga dituding kalibet jaringan teroris.
Jimmy is his girlfriend who is a Colombian citizen.	Jimmy iku pacangané kang kewarganagaraané Kolombia.
Vivek Oberoi doesn't just play an action role,	Vivek Oberoi ora namung meranaké peran action baé,
The solid pretzels are coated with a glazed portion and seasoned with salt.	Pretzel padhetan dilapisi karo pérangan kang kinclong lan diwènèhi uyah.
He became increasingly successful and increasingly well -known in the community.	Dhèwèké tambah sukses lan tambah kondhang ning masarakat.
Every year thousands of these frogs are caught for grazing.	Saben taune éwon kodhok iki dicekel kanggo kéwan ingonan.
The leaves of the tales look like a large shield.	Godhong tales dhapuré kaya tamèng kang ukurané gedhé.
From modeling he developed his career into an artist.	Saka model dhèwèké ngembangaké kariré dadi artis.
Efforts to suppress Indonesia’s independence by means of violence failed.	Usaha kanggo ngredam kamardikan Indonésia kanthi dalan kekerasan gagal.
Yakipunika is often referred to from Korean dishes like bulgogi and kalbi.	Yakipunika kerep diarani saka masakan Koréa kaya bulgogi lan kalbi.
Kysnesstranda is a former hamlet in the Norwegian kingdom.	Kysnesstranda punika dhusun ingkang kapernah ing praja Nurwègen.
Torsteinsvik is a former hamlet in the Norwegian kingdom.	Torsteinsvik punika dhusun ingkang kapernah ing praja Nurwègen.
Søreidgrenda is a former hamlet in the kingdom of Norway.	Søreidgrenda punika dhusun ingkang kapernah ing praja Nurwègen.
Stamneshella is a former hamlet in the kingdom of Norway.	Stamneshella punika dhusun ingkang kapernah ing praja Nurwègen.
Siggjarvågen is a former hamlet in the Norwegian kingdom.	Siggjarvågen punika dhusun ingkang kapernah ing praja Nurwègen.
Tjukkebygdi is a hamlet that was once a part of the Norwegian kingdom.	Tjukkebygdi punika dhusun ingkang kapernah ing praja Nurwègen.
Skjeljanger is a former hamlet in the Norwegian kingdom.	Skjeljanger punika dhusun ingkang kapernah ing praja Nurwègen.
Skarpeneset is a former hamlet in the Norwegian kingdom.	Skarpeneset punika dhusun ingkang kapernah ing praja Nurwègen.
Sekkingstad is a former hamlet in the kingdom of Norway.	Sekkingstad punika dhusun ingkang kapernah ing praja Nurwègen.
Trellevika is a former hamlet in the Norwegian kingdom.	Trellevika punika dhusun ingkang kapernah ing praja Nurwègen.
Toftevågen is a former hamlet in the Norwegian kingdom.	Toftevågen punika dhusun ingkang kapernah ing praja Nurwègen.
Sørstranda is a hamlet that was once a part of the Norwegian kingdom.	Sørstranda punika dhusun ingkang kapernah ing praja Nurwègen.
Sørekvingo is a former hamlet in the kingdom of Norway.	Sørekvingo punika dhusun ingkang kapernah ing praja Nurwègen.
Steinsland is a former hamlet in the Norwegian kingdom.	Steinsland punika dhusun ingkang kapernah ing praja Nurwègen.
Stanghelle is a former hamlet in the kingdom of Norway.	Stanghelle punika dhusun ingkang kapernah ing praja Nurwègen.
Snilstveit is a former hamlet in the kingdom of Norway.	Snilstveit punika dhusun ingkang kapernah ing praja Nurwègen.
Skråmestøi is a former hamlet in the Norwegian kingdom.	Skråmestøi punika dhusun ingkang kapernah ing praja Nurwègen.
Sørstrøno is a former hamlet in the kingdom of Norway.	Sørstrøno punika dhusun ingkang kapernah ing praja Nurwègen.
Søfteland is a former hamlet in the kingdom of Norway.	Søfteland punika dhusun ingkang kapernah ing praja Nurwègen.
Svortland is a hamlet that was once a part of the Norwegian kingdom.	Svortland punika dhusun ingkang kapernah ing praja Nurwègen.
Strandvik is a former hamlet in the Norwegian kingdom.	Strandvik punika dhusun ingkang kapernah ing praja Nurwègen.
Sollsvika is a former hamlet in the Norwegian kingdom.	Sollsvika punika dhusun ingkang kapernah ing praja Nurwègen.
Skurtveit is a former hamlet in the Norwegian kingdom.	Skurtveit punika dhusun ingkang kapernah ing praja Nurwègen.
Bringsinghaug is a former hamlet in the kingdom of Norway.	Bringsinghaug punika dhusun ingkang kapernah ing praja Nurwègen.
Batnfjordsøra is a former hamlet in the Norwegian kingdom.	Batnfjordsøra punika dhusun ingkang kapernah ing praja Nurwègen.
Halsanaustan is a former hamlet in the Norwegian kingdom.	Halsanaustan punika dhusun ingkang kapernah ing praja Nurwègen.
Fiskarstrand is a former hamlet in the kingdom of Norway.	Fiskarstrand punika dhusun ingkang kapernah ing praja Nurwègen.
Kristiansund is a former hamlet in Norway.	Kristiansund punika dhusun ingkang kapernah ing praja Nurwègen.
Boggestranda is a former hamlet in the Norwegian kingdom.	Boggestranda punika dhusun ingkang kapernah ing praja Nurwègen.
Uggdalseidet is a former hamlet in the kingdom of Norway.	Uggdalseidet punika dhusun ingkang kapernah ing praja Nurwègen.
Hjørungavåg is a former hamlet in the Norwegian kingdom.	Hjørungavåg punika dhusun ingkang kapernah ing praja Nurwègen.
Aukrasanden is a former hamlet in the kingdom of Norway.	Aukrasanden punika dhusun ingkang kapernah ing praja Nurwègen.
Innfjorden is a former hamlet in the Norwegian kingdom.	Innfjorden punika dhusun ingkang kapernah ing praja Nurwègen.
Hundeidvik is a hamlet that was once a part of the Norwegian kingdom.	Hundeidvik punika dhusun ingkang kapernah ing praja Nurwègen.
Elnesvågen is a former hamlet in the Norwegian kingdom.	Elnesvågen punika dhusun ingkang kapernah ing praja Nurwègen.
Eikesdalen is a former hamlet in the kingdom of Norway.	Eikesdalen punika dhusun ingkang kapernah ing praja Nurwègen.
Eggesbønes is a former hamlet in the Norwegian kingdom.	Eggesbønes punika dhusun ingkang kapernah ing praja Nurwègen.
Tørvikbygd is a former hamlet in the Norwegian kingdom.	Tørvikbygd punika dhusun ingkang kapernah ing praja Nurwègen.
Hollingen is a former hamlet in the Norwegian kingdom.	Hollingen punika dhusun ingkang kapernah ing praja Nurwègen.
Geiranger is a former hamlet in the kingdom of Norway.	Geiranger punika dhusun ingkang kapernah ing praja Nurwègen.
Hellesylt is a former hamlet in the Norwegian kingdom.	Hellesylt punika dhusun ingkang kapernah ing praja Nurwègen.
Gullstein is a former hamlet in the Norwegian kingdom.	Gullstein punika dhusun ingkang kapernah ing praja Nurwègen.
Fiskåbygd is a former hamlet in the Norwegian kingdom.	Fiskåbygd punika dhusun ingkang kapernah ing praja Nurwègen.
