Truman told Congress the program consisted of 21 articles.	Truman ngandharake ing Konggrès saprogram kang kapérang saka 21 pasal.
Illustration of a samurai doing charcoal doing seppuku	Ilustrasi samurai kang areng nindakaké seppuku
What causes gout is not well understood.	Sing marahi mandheging asem urat ora patiya dimangerteni.
There are several small towns and villages in each district.	Wonten sapérangan kutha alit lan désa ing saben distrik.
There are several small towns and villages in the district.	Wonten sapérangan kutha alit lan désa ing distrik.
There are several small towns and villages in Gunma by district.	Wonten sapérangan kutha alit lan désa ing Gunma miturut distrik.
Gunma is the northwestern prefecture in Kanto.	Gunma kalebet prefektur paling baratlaut ing Kanto.
Many of Edwards’s works have been reprinted regularly.	Kathah saking karya-karya Edwards sampun kacetak ulang kanthi teratur.
According to the size of the fabric width, there are generally three types of obi.	Miturut ukuran wiyaripun kain, kanthi umum wonten tigang jinis obi.
In the old days, dolls were only moved by dhalangs.	Ing jaman rumiyin, bonéka namung dipunobahaken déning dhalang.
The second season also airs at 7pm each episode.	Mangsa kaloro uga digiyaraké jam 7 bengi saben episodene.
Ingredients for making gimbap are rice, meat, and vegetables.	Bahan kanggé ndamel gimbap inggih punika sekul, daging, lan janganan.
The area has been inhabited by humans since 18.	Wewengkon punika wiwit dinggèni déning manungsa saking 18.
To make a bell, it takes approximately 27 tons of bronze.	Kanggé damel genta, kirang langkung mbetahaken 27 ton perunggu.
In a wide area 2.	Ing wewengkon kanthi wiyar 2.
Ethanol is often the fuel	Étanol asring minangka bahan bakar
The curved edge of the bulging empyka is called the cheoma.	Pinggiring empyak ingkang mlengkung manginggil punika dipunsebat cheoma.
Nowadays tiaras can be worn by many people.	Ing jaman sapunika tiara sampun saged dipunagem déning rakyat kathah.
Very little is known about the rest of his life.	Namung sakedhik ingkang dipunkawruhi prakawis sisa gesangipun.
A comparison table of the characteristics of image file types on the web.	Tabel komparasi karakteristik jinis file gambar ning web.
Charmander is rare when looking in the nature of reason.	Charmander kalebet langka manawi madosi ing alam alasan.
The anatomy of caecilia is adaptable to life on the ground.	Anatomi sesilia bisa adhaptasi ing panguripan ing lemah.
Ribs are very concerned about education.	Iga mentingake banget babagan pendhidhikan.
Cecilia likes wet and cold places.	Sesilia seneng panggonan-panggonan kang teles lan anyep.
According to taxonomy caecilia is divided into 6 families.	Miturut taksonomis sesilia dipérang dadi 6 familia.
His career as a ninja was mostly focused on taijutsu.	Kawegiganipun minangka ninja kathah fokus wonten ing taijutsu.
He also wrote a treatise on astronomy.	Piyambakipun ugi nyerat satunggaling risalaha bab astronomi.
Kyoto is associated with the following cities:	Kyoto gadhah gegayutan kutha kembat kaliyan:
Déby was the son of a shepherd.	Déby minangka putra saking penggembala.
The Mesozoic is marked by tectonic, climatic, and evolutionary activities.	Mesozoikum dipuntandhani kaliyan kagiyatan tektonik, iklim, lan evolusi.
Bandai (guard seat)	Bandai (papan kanggé lenggah ingkang njagi)
Sura (수라) is a bowl of rice and seeds.	Sura (수라) inggih punika semangkok sekul lan wiji-wijian.
Gagok is the art of singing a typical Korean traditional song.	Gagok inggih punika seni nyekaraken tembang tradhisional khas Koréa.
When Guy’s first appearance was during a chuunin exam.	Nalika katingalipun kapisan Guy inggih nalikanipun ujian chuunin.
Koreans call ginseng as insam.	Tiyang Koréa nyebat ginsèng minangka insam.
Coordinator State Nurse on Welfare	Mantri Nagara Koordinator Babagan Kesejahteraan
State Nurse Coordinator for Supervision	Mantri Nagara Koordinator Babagan Pengawasan
Chief Minister of Economics and Finance of the Ampera Cabinet;	Mantri Utama Babagan Ékonomi dan Keuangan Kabinet Ampera;
Coordinating Minister of State for Politics and Security;	Mantri Nagara Koordinator Babagan Pulitik dan Keamanan;
Minister of State for National Development Planning Affairs;	Mantri Nagara Urusan Perencana Pembangunan Nasional;
Seiyū often sings himself songs from the anime he stars in.	Seiyū asring nyekarakén piyambak lagu saking anime ingkang dipunbintangi.
Oomycota is playing a role both economically as well as scientifically.	Oomycota punika gadhah peran kanthi ékonomi ugi ilmiah.
Forms that are still sung:	Wujud-wujud ingkang taksih dipuntembangaken:
He received his law degree in 1936.	Piyambakipun pikantuk gelar hukumipun nalika taun 1936.
Hus was a pioneer of the Protestant movement.	Hus inggih punika satunggaling perintis obahan Protèstan.
There are several Pustaha stored:	Wonten sapérangan Pustaha ingkang dipunsimpen:
On the back of the star is the inscription of the Republic of Indonesia.	Ing sisih wingkingipun bintang dipungambaraken seratan Republik Indonesia.
The unusual tools needed in falconry include:	Piranti mirunggan ingkang dipunprelukaken ing falconry kados ta:
This is one of the best features for interaction.	Iki salah sawijining fitur sing paling apik kanggo interaksi.
France has a very wide scope.	Perancis gadhah ruang lingkup ingkang wiyar sanget.
Juubi is the original form of the nine bijuu.	Juubi minangka wujud asli saking sangang bijuu.
The spinning plant has been beaten repeatedly and moved hands.	Pabrik pemintalan sampun dipunyasa bola-bali lan pindhah tangan.
It was not used until the end of the 4th century.	Punika boten dipun-ginakaken langkung dangu saking pungkasan abad kaping 4.
France has 10 main mainland regions, namely:	Perancis gadhah 10 wewengkon daratan utama, inggih punika:
Of the six Vulliamy showed interest in his father’s work.	Saking enèm Vulliamy nedahaken remenipun marang pakaryan bapakipun.
Ferguson's notable work is described as follows:	Karya wigati Ferguson ingkang dipunandharaken punika:
Nibi is a Bijuu in the form of a cat.	Nibi inggih punika Bijuu ingkang awujud kucing.
Broca is also a researcher in physical anthropology.	Broca ugi minangka panaliti wonten ing antropologi fisik.
Cena started being a wrestler when he graduated college.	Cena miwiti dadi pegulat nalika lulus kuliah.
Sebastien Bourdais was born into a family of drivers.	Sebastien Bourdais miyos saking kulawarga pembalap.
The choice to choose Ferrari is in fact the wrong pot.	Pilihanipun milih Ferrari kasunyatan panci lepat.
Basque in Spain and France	Basque ing Nagari Spanyol lan Prancis
Location of the Basque provinces in Spain and France	Lokasi provinsi Basque ing Spanyol lan Prancis
The origin of the word is unknown.	Tembung tinutuan boten dipunmangertosi asal usulipun.
In addition to transwiki, there are other alternatives I can consider.	Saliyané transwiki, alternatif liya sing bisa ditimbangyaiku.
Types of slippers by shape:	Jenisé sandhal miturut wujudé:
So it gives a living shape, and the shape becomes a contour.	Saéngga mènèhi wujud ingkang urip, lan wujudé dadi kontur .
The shape of the blade as a benefit comes in many colors.	Wujudé graji minangka mupangate ana pirang-pirang warna.
Nonetheless, this policy covers a much broader scope than that.	Senadyan mangkono, kawicaksanan iki nyakup bab-bab luwih jembar saka iku.
Designed for articles that quote characters, movies, events, etc.	Diayahi tumrap artikel sing asipat kutipan tokoh, film, prastawa, lll.
Designed for articles of the nature of instructions, manuals, directions, etc.	Diayahi tumrap artikel sing asipat instruksi, manual, pituduh, lll.
Experts are developing usada to deal with the virus directly.	Para ahli lagi ngembangaké usada kanggo nangani virus kanthi langsung.
The wayang dongeng performance has no standard like the wayang kulit performance.	Pentas wayang dongèng ora ana pathokane kaya pagelaran wayang kulit.
His accession to the presidency was marked by the controversy of the rape case.	Olèhé dadi présidhèn ditandhani déning kontroversi kasus ruda peksa.
Some species are important timber producers.	Sawetara spésies minangka pangasil kayu sing wigati.
There is no exceptional treatment for dengue fever.	Ora ana perawatan mirunggan kanggo demam berdarah.
There are a few that are biased on their own.	Ana sakwetara kang bias diusudani dhéwé.
Kenanga does not include herbaceous plants.	Kenanga ora kalebu tuwuhan herba.
The usual warning signs appear before they get worse.	Tandha-tandha peringatan lumrahé katon sedurunge dadi saya parah.
But choose those who know,	Nanging pilih wong kang uningaa,
Most people with dengue recover and are well.	Sebagean gedhé wong kang kena dengue mari lan apik-apik waé.
The first dengue was recorded years ago.	Dengue pertaman kali ditulis taun-taun kang wis lumantar.
In the febrile phase, the person usually has a high fever.	Ing fase febrile, pawongam lumrahé ngalami demam dhuwur.
Percentage distribution:	Persentase sebaran bebrayan:
Because the day -to -day conditions are always complicated, chaotic.	Amarga kaanan padinan sing tansah gawé ruwet, semrawut.
Dengue is more common to the left and right of the equator.	Dengue luwih asring kadadéan ing kiwa-tengené ekuator.
Cannabis flowers can be used as medicines, the following are examples:	Kembang kenanga bisa minangka obat-obatan, ing ngisor iki tuladhané:
The lake is often considered a revered place by the villagers.	Sendhang asring dianggep panggonan kang kramat déning warga désa.
He was surrounded by śakuntas in the silence of the forest,	Dhèwèké dirubung déning śakuntas ing kasepèné wana,
My eye is ready to come,	Myang paningal kang sedya tumeka napi,
The perfection of your body is,	Kasampurnaning badanira puniko,
What is common today,	Inkang lumrah ing masa puniki,
Those who deserve to be rebuked,	Ingkang pantes kena ginuronan,
In many countries, summer is the school holiday season.	Ing akèh nagara, mangsa panas iku mangsa préinan sekolah.
Push the embankment he made,	Tulak tanggul kang panggawe,
Michael's robe,	Mikail kang asung sandhang,
The stars listed by constellation are	Lintang kang kadhaptar miturut rasi lintang yaiku
Swikee is a type of culinary food with frog basic ingredients.	Swikee iku jinising panganan wujud masakan kanthi bahan dhasar kodhok.
Cannabis includes plants that have quite the potential to be a source of carbohydrates.	Ganyong kalebu tuwuhan kang cukup poténsial kanggo sumber karbohidrat.
Ganyong can also be a plant that is a basic material of industry.	Ganyong uga bisa dadi tuwuhan kang dadi bahan dhasar indhustri.
This period of famine was followed by a season of disease.	Ing mangsa paceklik iki racaké banjur disusul usum penyakit.
Has a healthy nature and can take other people for granted.	Nduwéni sipat santé lan bisa nompo wong liya apa anané.
This plant is usually a side business of the residents.	Tuwuhan iki lumrahé dadi usaha sampingan para panduduk.
Fools are a type of small food or snack.	Gemblong iku jinising panganan cilik utawa kudhapan.
Enjoy traveling the world from the intellectual and the physical.	Seneng ngubengi donya saka intelektual lan fisik.
Has great ambition and a spirit of steel.	Nduwéni gegayuhan kang gedhé lan semangat baja.
Apparently pohung is common for animal feed.	Ketéla pohung biyasa kanggo panganan kéwan.
All species of scorpions have bark.	Kabèh  spésies kalajengking  duwé upas.
It takes a lot of interaction with a lot of people.	Perlu okeh srawung karo okeh wong.
Cassava contains nuts, though not as much as cassava.	Uwi ganyong ngandhut pathi, sanadyan ora akèh kaya ketéla rambat.
In urban areas it is also common to find low-lying areas.	Ing laladan kutha uga kerep tinemu palemahan kang dadi ara-ara.
When harvesting tubers, it depends on the area in which they are planted.	Nalika panén umbi, gumantung ing laladan kang dianggo nandur.
The bark is usually taken from the tuber, hence the name tuber plant.	Ganyong lumrahé dijupuk umbiné, mulané diarani tuwuhan umbi.
A cup or mug is a device used for drinking wine.	Cangkir utawa cingkir iku piranti kang digunakaké kanggo ngombé wédang.
Hydrocarbons are one of the most important sources of energy on earth.	Hidrokarbon yaiku salah sawijinè sumber ènergi paling wigati ing bumi.
The main ingredients of acetylene are calcium carbonate and coal.	Bahan utama panggawéan asetilena ya iku kalsium karbonat lan batubara.
Pasung is a type of food made from rice flour.	Pasung iku jinising panganan kang digawé saka glepung beras.
The joint in the heavy part is the head part of the joint.	Gandhèn ing pérangan kang abot yaiku pérangan sirah gandèn.
The round -shaped flakes are called klethuk flakes.	Déné emping ingkang wujudé bunder disebat emping klethuk.
Lepet also has some srondhol beans for its contents.	Lepet uga ana sing nganggo kacang srondhol kanggo isiné.
Apem ya is a food made from rice flour.	Apem ya iku panganan kang digawé saka glepung beras.
A chair or throne is a device in which to sit.	Kursi utawa dhampar iku piranti kang kanggo lungguh.
Hydrocarbons are hydrophobic in nature and are included in lipids.	Hidrokarbon asipat hidrofobik lan kalebu ing lipid.
Chairs are usually made of wood or plastic.	Dhingklik lumrahé digawé saka kayu utawa plastik.
The students intend to attend the seminar	Para murid pinuju mèlu seminar
Tiles are also fragile tools and belong to pottery.	Genthong uga piranthi kang gampang pecah lan kagolong barang grabah.
Betutu fish is preferred as a hook fish and a consumption fish.	Iwak betutu disenengi minangka iwakn pancingan lan iwak konsumsi.
The story therefore opens with Cakhwe’s confession in connection with his death.	Carita mula bukane penganan Cakhwe ana gegayutane karo matine dhèwèké.
The Australian flag is square in navy blue.	Gendéra Australia mbujur sangkar kanthi warna  biru segara.
Architecture symbolizes the connection of earth and sky (man and God).	Arsitekture nyimbolake gegayutane bumi lan langit (manusia lan Tuhane).
There are many types of bass guitars in use today.	Wonten kathah jinis gitar bass ingkang dipunangge ngantos sapunika.
A piano is a hand -played musical instrument.	Piano inggih punika piranti musik ingkang dipuntabuh kanthi asta.
Foods that can be given to hamsters:	Pakan kang bisa diwènèhake kanggo hamster:
The horizontal line has a ratio of 5: 1: 2.	Garis kang malang duwé rasio 5:1:2.
Aremania is among the most loyal supporters in Indonesia.	Aremania kalebu dadi suporter paling loyal kang ana ing Indonésia.
Treviso is a city in Italy.	Treviso wujud sawijining kutha ing Italia.
The striker is the position closest to the opponent’s goal.	Penyerang minangka posisi kang paling cedhak karo gawang lawan.
Copy the blank version below to use the template.	Salin vèrsi kothong ing ngisor iki kanggo migunakaké cithakan.
Allosaurus is one of the bipedal predators.	Allosaurus iku salah sawijiningpredator bipedal.
He is the one who has an athletic body posture and has the ability	Dhèwèké kang duwé postur awak kang atletis lan duwé kamampuan
A quadrilateral is a polygon that can be simple or complex.	Quadrilateral iku poligon sing bisa awujud prasaja utawa komplèks.
She is also a screenwriter in addition to being a film actress.	Dhèwèké uga dadi pancipta tetembangan saliyané dadi aktris filem.
Elastic rubber bands are useful for tying things.	Karet gelang asipat elastis mula mupangat kanggo naleni barang.
This template can also be used by entering such code:	Cithakan iki uga bisa dianggo kanthi nglebokake kayata kodhe :
But his life line does have to be a role player in the end.	Nanging garis uripé memang kudu dadi pemain peran ning akiré.
Braxton is an artist who cares about social issues.	Braxton kagolong artis kang preduli karo masalah sosial.
The principle of making rubber bands is very simple.	Prinsip panggawéyan karet gelang sedherhana banget.
Actually there is no mixture that can be called ideal.	Sebenere ora ana campuran kang bisa diarani ideal.
But he never stopped creating work.	Nanging dhèwèké ora mandhek anggoné nyipta karya.
Award in the category of best actress.	Award babagan kategori aktris kang paling apik.
He started learning acting from his stepfather who taught him acting.	Dhèwèké wiwit nyinaoni akting saka bapak tiriné kang ngajar akting.
He quit because he had to work to support himself.	Dhèwèké metu amarga kudu nyambut gawé kanggo mbiayai uripé dhéwé.
Since childhood he had a desire to be a marine biologist,	Awit cilik dhewekké duwé penginan dadi ahli biologi kelautan,
Not only did it produce a number of writings that were eventually published.	Ora namung ngasilaké sajumlah tulisan kang akiré dibukukaké.
Dunst has never been in a relationship with a single man.	Dunst ora tau suwé anggoné pacaran karo siji priya.
His mother had never been married not only recently, because of failure.	Ibuné tau bebrayana ora namung kapin pisan, amarga ngalami kegagalan.
Since the age of three, he has always been in front of the kodak.	Awit umur telung taunan, dhèwèké wis sok ning ngarepé kodhak.
The success of the film made Vin raise funds for	Kasuksesan filem iki anggawe Vin ngadakaké panggalangan dana kanggo
Keanu’s first experience in the world of roles began when he was	Pengalaman kaping pisanan Keanu ning dunya peran dimulai nalika dhèwèké
At the time, Holmes and his wife were married with a daughter	Nalika iku, Holmes karo bojoné bebrayanan bareng karo anak wadon
Now Yoko is starting to try to figure out social, political as well as events	Saiki Yoko wiwit nyoba nggeluti acara sosial, pulitik lan uga
In addition to being an actress named Ayushita is also a singer.	Saliyané dadi aktris kang jenengé Ayushita uga dadi penyanyi.
While the music line is mixed with the album line that he worked on.	Dene rengrengan musik disalarakae karo rengrengan album kang digarap.
An atom can be ionized by releasing one of its electrons.	Sawijining atom bisa diionisasi kanthi nguwalaké siji èlèktroné.
Her modeling talent came from her mother who had previously been a model.	Bakat modelling éntuk saka ibune kang dhisike tau dadi modhel.
Because for his artistic career he postponed his education.	Amarga kanggo karir kaartisané dhèwèké nunda pendidikané.
Glali is made from sugar which is given the color of the food.	Glali digawé saka gula kang diwènèhi warna panganan.
Neutrons and protons are two different types of fermions.	Neutron lan proton iku rong jinis fermion kang béda.
The wave function of the first five atomic orbitals.	Fungsi gelombang saka limang orbital atom pisanan.
Cologne has twin cities with the following cities:	Köln duwé gandhèngan kutha kembar karo kutha-kutha ing ngisor iki:
Over time, classical dances began to grow.	Dengan berjalannya waktu, jogèd-jogèd klasik wiwit tumuwuh.
Category: Junior high school in East Java	Kategori:Sekolah menengah pertama di Jawa Timur
The first Thanksgiving Day celebration.	Pahargyan Dinten Pamuji Sukur utawi ''Thanksgiving Day'' ingkang sepisanan.
Clothing in the history of development	Rasukan sajeroning sajarah parkembangan
Paraceratherium is a type of dinosaur that lived during the last days.	Paraceratherium ya iku jinis dinosaurus sing urip nalika jaman pungkasan.
This restaurant is known as a restaurant that upholds high standards.	Restoran iki ditepungi minangka restoran kang ngukuhaké standar dhuwur.
Clothing or apparel becomes one of the main needs of human beings.	Sandhangan utawa busana dadi salah sijining kabutuhan utama manungsa.
The hanbok for women is different from the hanbok for men.	Hanbok kanggo wong wadon béda karo hanbok wong lanang.
The garment is a cloth to cover the upper body.	Klambi iku kain kanggo nutupi awak pérangan ndhuwur.
Clothing protects invisible parts of the body.	Sandhangan nglindhungi pérangan awak kang ora katon.
The mention of bap varies based on the type of crop.	Panyebutan bap warna-warna dhedhasar jinis palawija.
Its fine lines and curves when viewed are really like the wind.	Garis-garis lan lekukan-lekukane kang alus yèn disawang pancen kaya angin.
Diabetic retinoes are damage to the eyes that can lead to “blindness”.	Retino diabetik iku kerusakan ing mata kang bisa njalari "kebutaan".
In fact, the hanbok consists of a jeogori (jacket) and a wedge (long pants).	Sajatiné,hanbok kasusun saka jeogori (jaket) lan baji (kathok dawa).
Tobacco contains what is called the alkaloid nicotine, yes it is a stimulant.	Bako ngamot kang diarani alkaloid nikotin, ya iku sawiji stimulan.
The descriptions of the literary works cited are:	Pratélan karya sastra yang dianggit, ya iku:
Murjangkung was chosen as the best prose version of Tempo.	Murjangkung kapilih minangka prosa paling apik versi Tempo.
A queen rat found by a farmer, P.	Sawijining ratu tikus kang tinemu déning sawijining wong tani, P.
That’s what might explain why he wrote a single theme.	Iku kang bisa njelasaké kenangapa dhèwèké nulis téma tunggal.
The painter's grandfather was rude to him.	Simbah kakungé tukang cat kang laku kasar marang dhèwèké.
Historical events are the main ingredient in his work.	Prastawa sujarah dadi bahan pokok ana pakaryané.
In art, people find and experience true freedom.	Ana ing seni, wong nemu lan ngalami kabébasan sajati.
When he was five years old, his father died.	Sawektu dhèwèké umur limang taun, bapaké séda.
Only through art can one attain divinity.	Mung liwat seni, wong bisa nyepaki keilahian.
The C64 dominated the bottom market of computers throughout the 1980s.	C64 ndominasi pasaran ngisor komputer ing saakèhé dasawarsa 1980-an.
Polytheism is the belief in one supreme deity.	Polytéisme iku kapercayan ananing déwa kang punjul siji.
Hakan is a good player when it comes to free kicks.	Hakan kuwi juru main sing apik yèn nendang bébas.
According to the story, imitation flowers have been around since 3.	Miturut carita, kembang imitasi wis ana wiwit 3.
In the mid-2000s, the exhibition hall could attract 200.	Ing tengahé dasawarsa 2000-an, gedhong pamèran iki bisa narik 200.
The following is an excerpt from a newspaper in the Netherlands.	Ing ngisor iki pratélaning ariwarta ing Nèderlan.
Category: Marriages by month	Kategori:Bebrayan miturut buwana
Zebra grévy in Samburu National Park	Zébra grévy ing Taman Nasional Samburu
Eliot was one of the most courageous innovators.	Eliot yaiku salah sijining inovator kang wani.
For humans, the fetal period begins at the beginning of the ninth week.	Kanggo manungsa, mangsa fètus anyak ing awaling minggu kasanga.
His parents, both of them, died when he was 15 years old.	Wong tuwané, loro-loroné, séda saurungé dhèwèké umur 15 taun.
Dhadhap srep is one of the Papilionaceae.	Dhadhap srep iku salah sawijing kang kalebu ing suku Papilionaceae.
He was the son of a French slave and nobleman.	Dhèwèké ya iku anak batur tukon lan priyayi Prancis.
Category: People by ethnicity	Kategori:Wong miturut ètnisitas
His father's name was Antoine, he was neither wealthy nor energetic.	Bapaké asma Antoine, ora sugih tur iya ora sregep.
Kipling is also the recipient of various honorary degrees and other awards.	Kipling uga dadi panampa manéka gelar kehormatan lan pahargyan liyané.
The flute is a family of musical instruments in the class of wooden wind instruments.	Suling yaiku kulawarga piranti musik ing golongan piranti sebul kayu.
Live buffalo starlings flock in large numbers or in small numbers.	Jalak kebo urip nggrombol kanthi cacah akèh utawa sethithik.
Paris operates as the center of the fashion industry in the country.	Paris lumaku minangka sèntralé indhustri fèsyen ing nagara iku.
The incident reached the internet through social media.	Kedadéan iki ngrambah internèt liwat medhia sosial.
The flute was the earliest musical instrument that still survives.	Suling yaiku piranti musik wiwitan kang isih lestari.
He also enjoys reading and writing poetry.	Dhèwèké uga seneng maca lan nulis geguritan.
The male buffalo star is longer than the female.	Jalak kebo lanang luwih dawa tinimbang kang wadon.
Because of his curiosity, he got bored of school and didn’t get a diploma.	Amarga kapinterane, dhèwèké bosen sekolah lan ora ngentukake diploma.
Schools are one example of goths.	Sekolah iku salah siji contoné gotrah.
At the age of 12 he was raped outside his apartment.	Ndèk umur 12 taun piyambaké wis diperkosa ndhik njaba apartemené.
Because of its bark, the buffalo starling is considered to be a pet.	Amarga ocèhané, jalak kebo diingu dadi kéwan pethétan.
Penné () is a type of cylindrical pasta.	Pénné () ya iku sawiji jinisé pasta sing wujudé sillinder.
He was a poet, an artist, a misunderstood visionary.	Dhèwèké penyair, seniman, visioner kang disalahpahami.
Celosia argentea is an annual plant that is often grown in gardens.	Celosia argentea tuwuhan taunan sing asring thukul ing kebon.
Quick start: copy paste, then fill in the blanks:	Quick start: copy paste, banjur isi sing kothong:
Catfish are commonly consumed especially in rural areas.	Iwak lélé umum dikonsumsi mnangka lawuh mligi ing padésan.
Blake lived and became famous since his death in 1827.	Blake nguja urip lan kondhang kawit sedane taun 1827.
Wall works as a freelance journalist.	Wall nyambut gawé minangka sawijining wartawati freelance.
The novel was adapted into a 1990 film form.	Novèl iki diadhaptasi kanthi wujud filem taun 1990.
This kinjeng is commonly called tokerok or kinjeng bala.	Kinjeng iki biyasa diarani tokèrok utawa kinjeng bala.
His collection of poems was published in 1933.	Kumpulan geguritané terbit taun 1933.
He learned to carve and grasp Gothic art.	Dhèwèké sinau ngukir lan ngugemi seni Gothik.
The most common material used for painting is paper.	Bahan kang lumrah digunakaké nglukis iku kertas.
