Paoran is a village in Kwanyar District, Bangkalan Regency, East Java.	Paoran iku désa ing Kacamatan Kwanyar, Kabupatèn Bangkalan, Jawa Wétan.
The closing parenthesis marks the end of the program.	Kurung kurawal tutup nandhakaké pungkasan program.
The number of words ordered by the second group is 30.	Tembung sing dipesen golongan kaloro cacahé 30.
The livelihood of this village is mainly in the form of agriculture.	Panguripan kang ndunungi kalurahan iki mligi wujud tetanèn.
Conventional rail trains are trains that are commonly encountered.	Sepur ril konvensional iku sepur kang umum ditemoni.
The raw material of the paint consists of 4 parts, yes it is	Bahan baku cèt kanthi dumadi saka 4 pérangan, ya iku
In addition to the terms in dhuwun, there are other terms, namely:	Saliyané istilah ing dhuwun, uga ana sebutan liyané, yaiku:
Below are the 32 teams that qualified for the final round.	Ing ngisor iki 32 tim kang lolos puteran final.
The village has an area of: -km2 with a population of about 6300 people.	Kalurahan iki jembaré:-km2 kanthi kang ndunungi watara 6300 jiwa.
Category: International sports organizations	Kategori:Organisasi olahraga internasional
The vuvuzela is a wind instrument or similar to that of a neighbor from South Africa.	Vuvuzela iku instrumèn sebul utawa mèmper sasangka saka Afrika Kidul.
Sumberjeruk is a village in the district of Jambésari D.	Sumberjeruk iku désa ing kacamatan Jambésari D.
Examples of usage can be seen on the template talk page.	Conto panggunaan bisa dipirsani ing kaca dhiskusi cithakan.
The man was killed by a thief in his home.	Priyayi iki tilar donya disédani déning maling ing omahé.
His paintings follow the flow of naturalism and his work is brilliantly beautiful.	Lukisané manut ilèn naturalis lan gawé kang sarwa éndah.
The word weed is technical and plastic in nature.	Tembung gulma asipat teknis lan plastis.
Entang is the 5th child of 6 friendships.	Entang iku anak nomer 5 saka 6 paseduluran.
It has a density of 34.2 inhabitants/km.	Praja iki duwé angka kapadhetan sing ndunungi 34,2 jiwa/km².
The World Cup was also the only one without going through a qualifying round.	Piala Donya iki uga siji-sijiné kang tanpa ngliwati babak kualifikasi.
Rank marks used on daily dines clothing	Tandha pangkat sing dipigunakaké ing sandhangan dines padinan
Rank badges worn on daily service clothes	Tandha pangkat sing dipigunakaké ing sandhangan dinas pedinan
The tradition of takbiran is held every evening of the festival	Tradhisi takbiran kang dianakaké saben malem riyaya
Rasulullah only performed this prayer together three times.	Rasulullah mung naté ngayahi salat iki kanthi bebarengan kaping telu.
The wheat salad should have benefits for the cover salad.	Salat witir kudu duwé mupangat kanggo salat panutup.
His father worked in a steel smelter.	Bapanipun nyambut damel ing paleburan baja.
Hadith related to witr prayer:	Hadis kang ana kaitané salat witir:
Bismillah had a good temperament, bold and upright and steadfast in heart.	Bisma duwé watak wantu becik, kendhel tur jejeg teguh atine.
Bisma (right) vows never to marry for the rest of his life.	Bisma (tengen) sumpah ora bakal nikah sadawaning urip.
The virtues of the dawn prayer with the congregation:	Kautaman salat fajar kanthi jama’ah:
Tenth: The person who always observes the dawn prayer is the person who	Kasepuluh: Wong kang tansah njaga salat fajar iku wong kang
Yuyutsuh affirmed the stance of choosing to defend the Pandavas.	Yuyutsuh ngukuhaké sikep milih mbela para Pandhawa.
Some new icons for stub templates can be found in commons.	Sawetara ikon anyar kanggo cithakan rintisan bisa ditemokaké ing commons.
Mancala is a family of toys with a world -famous space.	Mancala iku kaluwarganing dolanan nganggo papan sing kondhang ing donya.
Diana has a royal and aristocratic family background.	Diana duwé latar wuri kulawarga karajan lan bangsawan.
People who have a particular profession are called professionals.	Wong kang nduwé profèsi tartamtu diarani profèsional.
A national park with an area of ​​118.	Sawijining taman nasional sing jembaré punjul 118.
Crude oil is composed of hydrocarbons, hydrogen compounds and carbon.	Lenga patra dumadi saka hidrokarbon, senyawa hidrogen lan karbon.
In 2002, the city had 55 inhabitants.	Ing taun 2002, sing ndunungi kutha iki ana 55.
Percent or Percentage is a way of expressing a fraction of a hundred.	Persèn utawa Persèntase iku cara kanggo nyatakaké fraksi saka satus.
Makruh is the legal status of an activity within Islam.	Makruh iku status hukum tumrap siji aktivitas sajeroning Islam.
The twin cities associated with Bucharest are:	Kutha-kutha sing duwé gegayutan kutha kembar karo Bukarès ya iku:
Basic education is the foundation for secondary education.	Pendhidhikan dhasar dadi dhasar tumrap jenjang pendhidhikan menengah.
Primary schools are run by the government or the private sector.	Sekolah dhasar diadani déning pamaréntah utawa swasta.
Traditionally rackets are made of wood.	Sacara tradhisional rakèt digawé saka kayu.
In many places, bovinae for foodstuffs.	Ing akèh papan, bovinae kanggo bahan panganan.
Primary school students are typically 7-12 years old.	Pelajar sekolah dhasar lumrahé umur 7-12 taun.
The mountain before the 1991 eruption was 1 high.	Gunung iki sakdurunge letusan 1991 dhuwure 1.
Tan Lena was surrounded by a horrible giant	Tan lena ditlikung raseksa nggegirisi
Strive to maintain self -esteem	Ngupaya tetep ngregem ajining dhiri
The colonial nation had copied the face	Bangsa penjajah wus salin rupa
My eyes saw a white robe full of authority	Mripatku weruh jubah putih kumlebet kebak wibawa
Jan means around the main fact literally	Jan tegesé sak nyatane utama sakbenere
So that the bride and groom always have sufficiency in their attire.	Supaya pengentin sakloro tansah kecukupan ing sandhang.
It is written for words that have a sound.	Nya sinerat kanggé tetembungan ingkang gadhah swanten .
Werdine flowers are a favorite of many people.	Werdine kembang kembang iku dadi pepenging wong akèh.
The widow and the duke were shocked.	Sang nyai randha lan patih dadi kagèt banget.
God then sent a very wise apostle.	Allah banjur ngutus rasul sing pinter banget.
Binabar in speech and behavior	Binabar ing pangucap lan polah tingkah
Yogya's gumléwang left the remains of the sufferer	Yogya kang gumléwang ngetus ampas panandhang
It is said to be holy to oneself	Kababar pitutur suci tumrap dhiri
From the contents of the news story	Saka isining carita kang kababar
The fear and shivering became melted	Rasa wedi lan mindher dadi lumer
This setting serves as an economic and commuter train stop.	Setatsiyun iki dadi papan mandhege sepur ekonomi lan komuter.
Some rules you need when writing on a talk page:	Sawetara aturan sing perlu nalika nulis ing kaca dhiskusi :
Research that presents a primary source is not permitted.	Riset sing nyajèkaké sumber primèr ora diizinaké.
Cambodia can be propagated with seeds or stem cuttings.	Kemboja bisa ditangkaraké nganggo wiji utawa stèk watang.
Plumeria is now popular for outdoor ornamental plants.	Plumeria saiki populèr kanggo tuwuhan hias outdoor.
Raspberry disease can also be treated with cambodia.	Lara frambusia uga kena ditambani nganggo kemboja.
A safe additional preservative is khitosan.	Bahan pengawét tambahan kang aman ya iku khitosan.
To relieve pain in the teeth, it is possible to use Cambodian toothpaste.	Kanggo ngilangaké rasa lara ing untu, bisa nganggo tlutuh kemboja.
Cambodia can be propagated easily, by means of stem cuttings.	Kemboja bisa ditangkaraké kanthi gampang, kanthi cara stek watang.
In addition to ornamental plants, cambodia also has many benefits.	Saliyané kanggo tuwuhan hias, kemboja uga duwé akèh khasiyat.
Many traditional events are often held on the island, including:	Akèh acara adat sing kerep dianakaké ing pulo iki, antarané:
The basic ingredient for making soy sauce is soy sauce or black soy sauce.	Bahan dhasar kanggo nggawé kécap yaiku kedhelé utawa kedhelé ireng.
Treatment using chemicals is called chemotherapy.	Tetamban kanthi nggunakaké  zat kimia diarani kemoterapi.
Fishing can be differentiated according to the results of the bait.	Mancing iwak bisa dibédakaké miturut asil pancingané.
Sutiyoso is the sixth child of eight siblings.	Sutiyoso iku anak nomer enem saka wolu paseduluran.
Fishing is an activity to catch fish.	Mancing ya iku kagiyatan kanggo nyekel iwak.
But as the sea water began to recede, the mountains began to appear again.	Nanging nalika banyu segara wiwit asad, pagunungan wiwit katon manèh.
He remains low profile, despite being popular and rich,	Dhèwèké tetep low profile, meski sudah ngetop dan kaya,
The e-mail site's job is to send the e-mail to other e-mails.	Situs layang-e tugase ya iku ngirimake layang-e marang layang-e liyané.
The world of sound drawing began at the age of 18.	Dunia seni tarik suara wiwit ditekuni umur 18 taun.
Andrew Jackson was raised by his mother who lived with him.	Andrew Jackson diasuh déning ibune kang manggon bareng ipéné.
Category: Family of operating systems	Kategori:Kulawarga sistem operasi
About the years he worked until now there are still a lot of different beliefs.	Ngenani taun nggawéné nganti saiaki isih akèh sing béda kapercayan.
The technology for tilling the soil can be understood from the hoe.	Teknologi kanggo ngolah lemah bisa dimangertèni saka pacul.
The hoe is not only used in agriculture.	Pacul kuwi ora mung digunakaké ing babagan tetanèn.
But the material is not suitable for removing teeth.	Nanging bahan mau ora cocog kanggo njabut untu.
Ostriches have nests for freezing.	Manuk unta duwé susoh kanggo angkrem.
For example, an oblong shirt with colorful pictures and text.	Umpamané kaos oblong kang diwénéhi gambar lan tulisan kang warna-warna.
But he had never graduated.	Nanging ora sempet anggoné wisuda.
Dhelé is one of the legume plants.	Dhelé kalebu salah sijiné tetuwuhan polong-polongan.
Before making the river they liked parisuka, a party.	Sadurungé gawé bengawan padha suka parisuka, pista.
Hoes come in a variety of shapes and sizes.	Pacul duwé warna-warna wujud lan ukuran.
Glasses for nearsightedness were invented in the 14th century.	Kacamata kanggo rabun cedhak lagi tinemu ing abad 14.
There is no record as to why Stonhenge was punished.	Boten wonten cathetan ingkang nyebataken alesanipun Stonhenge dipunyasa.
Braces have a good function for aesthetics and health.	Kawat untu duwé fungsi kang apik kanggo éstetis lan kaséhatan.
But this tissue is not suitable if it is a wipe after eating.	Nanging tisu iki ora cocog yèn minangka lap sawisé mangan.
A magnet is an object or matter that has a magnetic field.	Magnèt ya iku obyek utawa matéri kang duwé médhan magnèt.
The barbed wire was like a rope made of metal.	Kawat racaké dhapuré kaya tali kang digawé saka logam.
Wire is a material made of long metal.	Kawat yaiku bahan kang digawé saka logam kang dawa.
There are guidelines so that it is not wrong to choose a dentist.	Ana pathokan supaya ora salah milih dhokter untu.
A seat belt is a seat belt that is on the car.	Sabuk pengaman ya iku sabuk kang ana ing mobil.
Fireworks are explosive materials.	Kembang api ya iku materi kang bisa njeblug.
D and a professor's degree in their alma mater.	D lan gelar professor ing almamatere mau.
Wires come in different sizes and shapes according to their purpose.	Kawat nduwéni ukuran lan bwangun kang warna-warna miturut gunané.
Pastels have a bright color, almost like oil paint.	Pastèl nduwéni warna kang cerah, méh padha kaya cat lenga.
Clana is made of cotton, velvet, nylon.	Clana ana kang digawé saka bahan katun, bludru, kain nilon.
Clans come in a variety of shapes and colors.	Clana duwé warna-warna wujud lan warna.
Mycotoxin is a term to refer to a toxin produced by it	Mikotoksin ya iku istilah kanggo ngrujuk toksin kang dasilake déning
Secondary metabolite compounds are grouped into three main groups, yes it is	Senyawa metabolit sekunder diklompokake dadi telung golongan utama, ya iku
His father was a pharmacy businessman and his mother owned a banana plantation.	Bapake ya iku pengusaha farmasilan ibune duwé perkebunan gedhang.
The word spoon usually means a spoon to eat.	Tembung séndhok lumrahé duwé teges séndhok kang kanggo mangan.
The digestive system of flatworms is called the gastrovascular system.	Sistem pencernaan cacing pipih diarani sistem gastrovaskuler.
Entubé gegremet can cause allergies in humans.	Entubé gegremet bisa ndadèkaké alergi tumrap manungsa.
The remaining soaking water is then drained and discarded.	Banyu sisa rendheman banjur dicidhuk lan dibuwang.
His fork is made unusual for eating salads.	Garpu kang digawé mirunggan kanggo mangan salad.
This fork is for eating pudding or sponge.	Garpu iki minangka mangan puding utawa bolu.
A fork is usually used in pairs with a spoon.	Garpu lumrahé dianggo sepasang karo séndok.
After his father died of illness.	Sawisa bapané ninggal dunya amarga lara.
Tofu is made from lentils.	Tahu sumedhang digawé saka dhelè.
To create tones on the keyboard also use a tuning fork.	Kanggo nggawé nadha-nadha ing keyboard uga nggunakaké garpu tala.
Examples of plant-derived phytoalexins are:	Tuladha-tuladha fitoaleksin kang diasilake déning tuwuhan ya iku:
The spoon is also exposed for therapy.	Séndhok uga kena kanggo terapi.
The spoon can be made of metal.	Séndhok bisa digawé saka logam.
Tessy often teased other female actresses who were on stage with her.	Tessy kerep nggoda aktris wanita liyané kang sepanggung karo dhèwèké.
Dry cough is characteristic of the early stages of the disease.	Batuk garing minangka ciri saka tahap wiwitan penyakit iki.
Wallet to carry passport when traveling	Dhompèt kanggo gawa paspor nalika lelungan
Charcoal is used in various uses such as pencils or crayons.	Areng dipigunakaké sajeroning kagunan rupa kaya potlot utawa krayon.
Awanda’s writing grew hundreds of years ago before letters appeared.	Tulisan awanda tuwuh atusan taun kapungkur sadurungé muncul hurup.
A spoon is a kitchen utensil for kneading sauces or other spices.	Cowèk iku piranti pawon kanggo nguleg sambel utawa bumbu liyané.
Charcoal can also be used to fuel motor vehicles.	Areng uga bisa kanggo bahan bakar kendharaan motor.
A wallet is a device for holding money.	Dhompèt ya iku piranti kanggo wadhah dhuwit.
Volataire was born into a middle -class family, his father working as a lawyer.	Volataire lair saka kulawarga menengah, bapakné makarya dadi ahli hukum.
Like tempeh, tofu is eaten as a folk food.	Kayadéné témpé, tahu diglepungi minangka panganan rakyat.
The fat rice is the rice that is widely grown and loved.	Paré gajih ya iku paré kang akèh ditandhur lan disenéngi.
Fighters in Cavite province got an early victory.	Pejuwang ing provinsi Cavite éntuk kamenangan awal.
Category: Movies by true story	Kategori:Film miturut kisah nyata
Currently, the Palestinian territories are divided into two political entities:	Saiki, wewengkon Palèstina dipérang dadi rong èntitas pulitik:
Wikramawardhana died at the end of 1427.	Wikramawardhana séda ing pungkasan taun 1427.
Serama of Malaysian descent is still relatively new.	Serama turunan Malaysia iku isih kagolong anyar.
Rhizomes are key to having the efficacy of overcoming digestive disorders.	Rimpang temu kunci duwé khasiat ngatasi gangguan pencernaan.
Cactus can grow for a long time without water.	Kaktus bisa tuwuh ing wektu kang suwé tanpa banyu.
Cactus with long and sharp thorns.	Kaktus mawa eri kang dawa sarta landhep.
The islands are divided into two parts: north and south of the equator.	Kapuloan iki dipérang dadi rong wilahan: lor lan kidul khatulistiwa.
The mosque has a main structure and a porch.	Masjid punika gadhah yasan-yasan indhuk lan serambi.
In 1986 the surrounding ocean was declared a marine reserve.	Taun 1986 lautan ing saubengé ditélakaké minangka cadhangan kalautan.
This plant can be found in kettle forests up to an elevation of 1000m.	Tuwuhan iki bisa tinemu ing alas ketel nganti èlevasi 1000m.
Bratawali trees can be found growing grounds in forests or farms.	Wit bratawali bisa tinemu thukul alasan ing alas utawa tegalan.
His pasture is on the coast or by the sea.	Kang pangonané ana ing pasisir utawa ing pinggir segara.
Menhir ya is a historical relic in the form of stone.	Menhir ya iku paninggalan sajarah awujud watu.
Brevipalpus phoenicis, ama tea plant that damages the leaves.	Brevipalpus phoenicis, ama tuwuhan tèh sing ngrusak godhong.
Black tea is one of the shrub plants.	Temu ireng iku salah siji tuwuhan semak.
The kencur empon consists of a tree that has a pseudo-stem and a stalk.	Empon-empon kencur kalebu wit kang nduwè gagang semu lan rungkut.
The shrub tree grows erect, straight, and erect but tends to shrink.	Wit remujung thukulé ngadeg, lurus, lan tegak nanging cenderung rungkut.
Throughout their lives, humans have had different names.	Sasuwene urip, manungsa duwé sebutan kang béda-béda.
This creeping plant can have a height of up to 15 m.	Tuwuhan ngrambat iki bisa duwé dhuwur nganti 15 m.
Gunungan is a puppet image that is shaped like a mountain.	Gunungan inggih punika gambar wayang ingkang wujudipun kados gunung.
The types of barns vary based on the country or province.	Jinising lumbung manéka macem dhedhasar nagara utawa provinsi.
Cloves are dried flower buds from the clove tree.	Cengkèh iku kuntum kembang kang garing saka wit cengkèh.
The flowers are on a stalk that forms a stalk of rhizomes.	Kembang ana ing gagang sing wujud dedawan saka rimpang.
The loop is also decorated with jasmine flowers.	Ing gelung uga dipunparingi roncenan kembang mlathi.
Plants grow on the surface of calm water.	Tetuwuhan tuwuh ing lumahing banyu sing anteng.
Dinda is an actress who has starred in many movies.	Dinda ya iku aktris kang main ing akèh filem.
Srikandhi is well known as a female soldier.	Srikandhi kondhang minangka prajurit èstri.
Sugar is an ingredient that is commonly the result of fermentation.	Gula iku bahan kang umum asil fermèntasi.
Brick is an artificial material for making walls.	Bata bahan yasan kanggo nggawé témbok.
Manatees are known as aquatic animals.	Manatee dikenal minangka kéwan banyu.
Though ish nom, but the ability to create songs can be underestimated.	Sanadyan ish nom, nanging kemampuan ngripta tembang bisa dianggep remeh.
Kamasa is also very fond of listening to jazz, classical and rock music.	Kamasipun ugi remen sanget mirengaken musik jazz, klasik kaliyan rock.
This template allows you to load panoramic images.	Cithakan iki andadèkak’e panjenengan bisa ngamot gambar panorama.
The electric current produced is approximately 1 ampere.	Arus listrik kang diasilaké kurang luwih 1 ampere.
Transistors can be distinguished based on several categories:	Transistor bisa dibédakaké dhedhasar sapérangan kategori:
Garin is a creative and productive director.	Garin iku kalebu sutradara kang kréatif lan produktif.
These devices can be considered the basis of people making computers.	Piranti iki bisa dianggep dhasar wong nggawe komputer.
It is very difficult to distinguish male and female starlings.	Angèl banget mbédakake manuk jalak lanang lan wadon.
This bird is a rare raptor.	Manuk iki minangka raptor kang langka.
Transistors work for electric faucets.	Transistor bisa kanggo kran listrik.
Before becoming an artist, he did all sorts of work.	Sadurungé dadi seniman, panjenengané nglakoni saanane pagawéan.
Military dances or other wireng dances are examples:	Jogèd-jogèd kaprajuritan utawa jogèd wireng liya tuladhané:
Laptops have exceptionally designed components.	Laptop nduwé komponèn-komponèn kang dirancang mirunggan.
Interests in human life are insignificant and not destructive.	Mumpangate ing sajeroning panguripan manungsa ora wigati lan ora ngérusak.
Cigarettes contain chemicals that are harmful to the health of the body.	Rokok duwé kandhungan kimia kang asipat mbahayani kanggo kasarasan awak.
Basketball is one of the most popular sports in the world.	Baskèt yaiku salah sawjining ulah raga kang misuwur ing donya.
Square meatballs are meatballs that are square or square.	Bakso kotak yaiku bakso kang dhapuré kotak utawa pasagi empat.
The name of the meatballs is usually the same as the meat that is the ingredient.	Jenengé bakso lumrahé padha kaya daging kang dadi bahané.
Cucumbers can also act as a stress reliever.	Timun uga bisa minangka ngedunke tensi.
In addition to being a singer, she is also a model and soap opera actress.	Saliyané penyanyi,dhèwèke uga model lan juru main sinétron.
Akashiyaki is considered a unique food typical of the city of Akashi.	Akashiyaki dianggep panganan unik khas kutha Akashi.
His mother estimated that he earned five thousand bucks a day.	Ibuné njatah dhèwèké olèh dhuwit jajan limang éwu saben dinané.
Andien learned about singing since he was three years old.	Andien sinau babagan nembang awit isih umur telung taun.
Larger from a family with a strong religious foundation.	Gedhé saka kulawarga kang duwé dhasar agama kang kuwat.
He is a director known for his idealism.	Dhèwèké iku sutradara kang kondhang amarga idealismené.
Dominique has a hobby of swimming and biking.	Dominique duwé hobby nglangi lan pit-pitan.
Pǔyí 溥儀 is also known as Henry	Pǔyí溥儀uga ditepungi kanthi jeneng Henry
He became well -known in the community for being a supporter in comedy	Dhèwèké dadi kondhang ing masarakat amarga dadi pendukung ing komedi
Among the famous figures in the field of literature at that time were:	Ing antarane tokoh misuwur ing babagan kausastran nalika semana yaiku:
His friend tried to comfort him for half an hour longer.	Kancané nyoba ngenengaké dhèwèké nganti satengah jam luwih suwené.
He grew closer to his wife since he was sick.	Dhèwèké tambah cedhak karo garwané wiwit akur awit dhèwèké lara.
He couldn't bear to know that one of his friends was silent.	Dhèwèké ora tahan manawa ngerti ana kancané kang lagi meneng.
He was born into a poor family.	Panjenenganipun miyos saking kulawargi ingkang kekirangan.
The case is being worked on by the authorities.	Kasus iki lagi digarap déning para pihak kang berwajib.
His prospective mother -in -law did not know that he was involved.	Calon maratuwané ora ngerti manawa dhèwèké mèlu.
Andity has released her first album.	Andity wis ngrilis albumé kang kaping pisanané.
The development of science in this era seems to be.	Ngrembakane ngelmu ing jaman iki kaperang dadi.
Vicky learned to sing in a self -taught way.	Vicky sinau nyanyi kanthi cara otodidak.
The pair were crowned champions.	Pasangan iki dinobataké dadi jawara.
Under atmospheric conditions, LPG becomes a gas.	Ing sajeroning kondisi atmosfer, èlpiji dadi gas.
The woman who is 160cm tall and weighs only 45kg is this	Wanita kang duwé dhuwur 160cm lan boboté mung 45kg iki
Many of the artists involved support the fundraising, as it were	Akèh artis kang mèlu nyengkuyung panggalangan dana mau, kaya ta
Narji married his girlfriend after a three -year courtship.	Narji nikah karo pacaré sawisé pacaran kang suwené telung taun.
Emerged born from a family of traditional artists.	Timbul lair saka kulawarga seniman tradhisional.
He learned about music by self -taught.	Dhèwèké sinau babagan musik kanthi autodidak.
V 1850) in order to reduce the amount of salt in it.	V 1850) supaya bisa ngurangi babagan candhu iku.
Pretty’s huge body is often a joke in her acting.	Badanipun Pretty ingkang ageng asring dados guyonan wonten ing aktingipun.
Omaswati is an Indonesian actress and comedian.	Omaswati punika salah satunggaling aktris saha pelawak Indonésia.
Oxcerila who used to be called Oxcel started acting on the big screen.	Oxcerila kang biyasa diundang Oxcel wiwit akting ing layar amba.
During the fasting month Narji also often gets a job to joke.	Nalika sasi pasa Narji uga kerep éntuk job kanggo nglawak.
Mandra started his career through his jokes in Betawi lenong.	Mandra miwiti kariré lumantar lawakané ing lenong Betawi.
Kiwil’s personal life was also in the press spotlight.	Kauripan pribadhiné Kiwil uga dadi sorotan pers.
Mandra is married to a woman named Mila.	Mandra nikah karo wong wadon kang jenengé Mila.
Becky has always seen events that cause problems	Becky kang wis sok weruh kadadian kang gawé masalah ning
Becky for the story and solving the problem together.	Becky kanggo carita lan ngerampungaké masalahé bebarengan.
He also led his own company in terms of business.	Dhèwèké uga mimpin dhéwé perusahaané ing babagan bisnis.
There he also grew up and studied for the rest of his life.	Ing kono uga dhéwéke gedhé lan sinau sakdawaning urip.
He who wanted to take care of both could not take care of his time.	Dhèwèké kang kepéngin ngurusi loro-loroné ora bisa ngurus wektuné.
Bruno was born into an art family.	Bruno lair ing kulawarga seni.
In his personal affairs, he admits to having a girlfriend.	Ning gayutan pribadiné, dhèwèké ngakuni wis duwé pacar.
For him, his own life was a choice.	Kanggo dhèwèké, urip dhếwế iku dadi pilihan.
Floating markets are also commonly used to barter.	Pasar kumambang uga biyasa dianggo tukar barang (barter).
There are 2 opinions that describe the history of Batagor, namely;	Ana 2 pendhapat kang ngadhakake sajarah batagor, yaiku;
Mansholt came from a family of socialist peasants from Groningen.	Mansholt asalé saka kulawarga wong tani sosialis saka Groningen.
From the big screen now Aura is trying to try the world of soap operas.	Saka layar lebar saiki Aura nyoba kanggo nyoba donya sinétron.
Apparently the producer was happy when he imitated it	Jebulé sing dadi prodhuser seneng nalika dhèwèké nirukaké
