The thing to keep in mind is how to process the meat before eating it.	Kang kudu digatékaké ya iku carané ngolah daging sadurungé dipangan.
Ants become infected with this fungus when ants are infected with fungal spores.	Semut kena infeksi jamur iki nalika semut ditèmplèki spora jamur.
The slice is a thin sheet of beef that is seasoned.	Déndéng sayat yaiku lembaran tipis daging sapi kang dibumboni.
The ear is an organ that can detect or recognize sound.	Kuping iku siji organ kang bisa ndhetèksi utawa ngenal swara.
Ants have intelligent swarms and have pheromones.	Semut nduwé gerombolan kang cerdas lan nduwé feromon.
Now there is a cow feed that does not depend on the season.	Saiki ana pakan sapi kang ora gumantung saka mangsa.
Bat manure can be an organic fertilizer for plants.	Tai lawa bisa dadi pupuk organik kanggo tuwuhan.
Some examples of foods that contain pork:	Sapérangan conto panganan kang ngandhut babi:
This proteinfeed is made from vegetable waste.	Protefeed iki bahané saka sampah nabati.
Cow’s milk can be a great source of protein.	Susu sapi bisa dadi sumber protéin.
Lava is an animal that likes to eat ripe fruit.	Lawa kalebu kéwan kang senengané nggrogoti woh-wohan kang wis mateng.
Even rising sea levels will affect coastal ecosystems.	Bahkan mundhakingn banyu segara bakal mengaruhi ékosistem pasisir.
This was a turning point in the author's life.	Pupunika dados titik walik ing kagesangan pangarang punika.
Carbon dioxide gas can also be eliminated directly.	Gas karbon dioksida uga bisa diilangaké kanthi langsung.
The racers guarded in the middle of the field themselves.	Para bèg racaké njaga ing paruh lapangan dhéwé.
Dostoyevsky suffered from severe gambling addiction and its consequences.	Dostoyevsky nandhang kacandhuan main ingkang parah lan akibat-akibatipun.
This qualifying format has been changed from previous tournaments.	Format kwalifikasi iki wis diowahi saka turnamèn-turnamèn sadurungé.
The legal sources sig used to make the yes decision are:	Sumber-sumber hukum sig dipigunakaké naika nggawé kaputusan ya iku:
Severe damage can be repaired in a variety of ways.	Karusakan kang parah bisa diatasi kanthi warna-warna cara.
The region is divided into 8 political entities:	Kawasan iki dipérang dadi 8 entitas pulitik:
The global average temperature on the earth's surface has risen to 0.	Suhu rata-rata global ing lumahing bumi wis mundhak 0.
Countries printed in italics did not participate in the final round	Negara sing dicithak miring ora mélu babak final
Its processed from locusts	Sawijining olahan saka walang
Butterflies are also a species of caterpillar derived from the cocoon of caterpillars	Kupu uga kagolong kéwan iber-iberan asalé saka enthungé uler
There is a misconception that mammals are bigger than elephants.	Ana kasalahpahaman yèn mamut luwih gedhé tinimbang gajah.
Pigeons can feed on corn, grain and rice.	Manuk dara bisa dipakani jagung, gabah lan beras.
Kinjeng is spread on all continents except Antarctica.	Kinjeng kasebar ing kabèh benua kajaba Antartika.
A tree is a plant with a trunk and twigs that contain wood.	Wit iku tetuwuhan kanthi watang lan pang kang ngandhut kayu.
There are 16 countries participating in this tournament, namely:	Ana 16 nagara sing mèlu turnamèn iki, ya iku:
The scapula forms the posterior part of the shoulder girdle.	Scapula mbentuk pérangan posterior saka gelang bahu.
The chest is an anatomical part in humans and animals.	Dhadha iku pérangan anatomi ing manungsa lan kéwan.
The soles of normal adult feet are curved.	Tlapak sikil wong diwasa normal iku mlengkung.
The elbow is one part of the hand.	Sikut minangka salah siji péranganing tangan.
The info template is used as the basic template of the message box.	Cithakan info dipigunakaké minangka cithakan dhasar kothak pesen.
Wikipedia is not a blog so anyone can post personal data.	Wikipedia dudu blog saéngga sapa waé bisa nampilaké data pribadi.
Fully protected pages can only be edited by the administrator.	Kaca sing direksa penuh mung bisa disunting déning panata.
Creating an info box is the same as creating another page.	Gawé kothak info padha waé karo gawé kaca liyané.
Page redirects are valid only once.	Pengalihan kaca mung berlaku sepisan waé.
For an example like the beginning of a page, it can be created this way:	Kanggo conto kaya wiwitan kaca, bisa digawé kanthi cara iki:
Do you have any tips that other naraguna can use?	Duwé kiat-kiat sing bisa dianggo déning naraguna liya?
The purpose of the block is protection, not punishment.	Gunané pamblokiran yakuwi perlindhungan, dudu ukuman.
Use the "textalign" parameter to specify the text alignment of the message content.	Gunakna parameter "textalign" kanggo nemtokaké text alignment isi pesen.
Click "move" and you will be taken to a new page.	Klik "pindhahen" lan panjenengan bakal digawa menyang kaca sing anyar.
Use the "width" parameter to specify the width of the box.	Gunakna parameter "width" kanggo nemtokaké jembar kothak.
Prokaryotes have no histones or nuclei.	Prokariota ora duwé histon utawa nukleus.
Below the consonants are created without the use of lung movements.	Ing ngisor konsonan sing diciptakaké tanpa migunakaké obahan paru-paru.
Before self -healing, the cell will undergo several phases.	Sadurungé sigar dhiri, sel bakal nglakoni sapérangan fase.
Optics has its own identity, society, and conference.	Babagan optika duwé identitas, masarakat, lan konferènsiné dhéwé.
According to the 1999 census, the population of the city is.	Miturut sènsus taun 1999, sing ndunungi kutha iki yakuwi .
Churchill attended a military academy at Sandhurst.	Churchill tumut akadhemi militèr ing Sandhurst.
Category: Nobel Prize winner in chemistry	Kategori:Pamenang Bebungah Nobel babagan kimia
Category: Nobel Prize -winning British figures	Kategori:Tokoh Inggris pamenang Bebungah Nobel
This plant does not require much attention to grow well.	Tuwuhan iki ora akèh merlokaké kawigatèn kanggo tuwuh becik.
Verbenaceae is one of the member tribes of flowering plants.	Verbenaceae iku salah siji suku anggota tetuwuhan ngembang.
The village has an area of: -km2 with a population of about 2964 people.	Désa iki jembaré:-km2 kanthi sing ndunungi watara 2964 jiwa.
Riga, which covers an area of ​​307.17km², covers about 731 km2.	Riga, kang wiyar wewengkoné 307,17km², kang ndunungi watara 731.
Pengkal is a wyanjana garment in the Javanese script Hanacaraka	Péngkal iku sandhangan wyanjana sajeroning aksara Jawa Hanacaraka
Rikat weavers grow and are relatively easy to harvest and transport.	Penjalin rikat tuwuh lan relatif gampang dipanèn sarta ditransprotasi.
The weavers commonly used in the industry are not very numerous.	Penjalin sing umum dipigunakaké sajeroning indhustri ora patiya akèh.
This creeping plant is mostly found in tropical forests.	Tetuwuhan mrambat iki paling akèh tinemu ing alas-alas tropika.
The word doomsday is often defined as the day when the world is crushed.	Tembung kiyamat asring diartèkaké dina nalika donya remuk.
Kunthi feels she doesn't need children because she is still a virgin.	Kunthi rumangsa ora butuh anak amarga isih prawan.
Santa wears clothes similar to those of a bishop.	Sinterklas nganggo sandhangan mèmper karo biskop.
The village has an area of ​​3.65km2 with a population of about 3.	Désa iki jembaré: 3,65km2 kanthi sing ndunungi watara 3.
The village is an area of: -5.00km2 with an all-around-soul dwelling.	Désa iki jembaré:-5,00km2 kanthi sing ndunungi watara-jiwa.
The village is -6.32km² wide with an all-around-soul dwelling.	Désa iki jembaré:-6,32km² kanthi sing ndunungi watara-jiwa.
Boer sheep are the most popular beef sheep in Indonesia.	Wedhus boer kalebu wedhus pedaging kang paling moncèr ing Indonésia.
In the western tradition, Christmas celebrations also contain non-religious aspects.	Jroning tradhisi kulon, pèngetan Natal uga ngandhut aspèk non-agamawi.
A plate containing traditional Turkish Eid -ul -Adha food.	Piring sing isiné panganan tradisional Idul Adha khas Turki.
The boundaries of Hulu Sungai Lor Regency are:	Wates wewengkon Kabupatèn Hulu Sungai Lor yaiku:
Kotabaru has 90 small islands, a third of which do not yet have names.	Kotabaru duwé 90 pulo cilik, seproteloné durung duwé jeneng.
The district has 20 districts, namely:	Kabupatèn iki nduwè 20 kacamatan, yaiku:
Hulu Sungai Tengah district is a district in the province of South Kalimantan.	Kabupatèn Hulu Sungai Tengah iku kabupatèn ing Provinsi Kalimantan Kidul.
The release date is written in parentheses	Tanggal rilis ditulis sajeroning tandha kurung
The first steam power vehicles were built in the late 18th century.	Wahan tenaga uwab pisanan digawé nalika pungkasan abad kaping 18.
The population of the downtown area is 17.	Cacahing padunung ing wewengkon pusat kutha ya iku 17.
Pompong boats for transportation between small islands	Perahu pompong kanggo transportasi antar pulo cilik
In the human scrotum and some mammals can be located pubic hairs.	Ing skrotum manungsa lan sawatara mamalia bisa dumunung rambut pubis.
Some health problems in the scrotum that need to be considered:	Sawetara masalah kaséhatan ing skrotum kang perlu diwigatèkaké:
Mastigophora includes creatures that live in a heterotrophic way.	Mastigophora kalebu makluk kang urip kanthi cara heterotrof.
There are two main parts that make up a microscope, namely:	Ana rong pérangan utama kang lumrahé nyusun mikroskop, yaiku:
Archaea are small, simple organisms.	Archaea iku wujudé cilik, wujud organisme kang prasaja.
The district has 15 districts, namely:	Kabupatèn iki nduwè 15 kacamatan, yaiku:
The total number projected for 2007 is 338.	Okèhé sing ndunungi miturut proyeksi kanggo taun 2007 yaiku 338.
Ballarat is a city in Australia.	Ballarat iku salah sawijining kutha ing Australia.
Suppose you expand the box like a beach isn’t it?	Upamané ditambahi kothak ngéné pasisirs ora ya?
The verse number is written at the end of each verse.	Nomor ayat ditulis ing pungkasan saben ayat.
The arrival is sometimes always welcome.	Rawuhe para kadang tansah diantu-antu.
The village is divided into 6 hamlets, namely:	Kalurahan iki kapérang dadi 6 dhusun, ya iku:
Lumpang is a device for pounding seeds or empon-empon.	Lumpang yaiku piranti kanggo nutu wiji-wijian utawa empon-empon.
Nohan means moon, his character is happy and sensuous, asan, blasphemous.	Nohan tegesé rembulan, wateké bungah lan sengsem, asan, kena pitenah.
Gigis means earth, broad character, preserve, fire.	Gigis tegesé bumi, watêké jembar, ngreksa, momot.
Jagur means tiger, fierce, alert, flexible, rosy.	Jagur tegesé macan, wateké galak, awas, luwes, rosa.
D) in the same higher education in 1985.	D) ing pawiyatan luhur kang padha taun 1985.
D) 1970 in the same high school.	D) taun 1970 ing pawiyatan luhur kang padha.
D) in the same high school in 1964.	D) ing pawiyatan luhur kang padha taun 1964.
Knecht Ruprecht is a frequent form of black and white man.	Knecht Ruprecht iku wujudé kerepé wong sing ireng lan brèwokan.
D) in 1982 in the same high school.	D) taun 1982 ing pawiyatan luhur kang padha.
According to one art historian, there are three phases of Cubism.	Miturut siji sajarawan seni, ana telung fase Kubisme.
Kedungsana is a village in Plumbon District, Cirebon Regency, West Java.	Kedungsana iku désa ing Kacamatan Plumbon, Kabupatèn Cirebon, Jawa Kulon.
Karangasem is a village in Plumbon District, Cirebon Regency, West Java.	Karangasem iku désa ing Kacamatan Plumbon, Kabupatèn Cirebon, Jawa Kulon.
Panongan is a village in Palimanan District, Cirebon Regency, West Java.	Panongan iku désa ing Kacamatan Palimanan, Kabupatèn Cirebon, Jawa Kulon.
Cisaat is a village in Dukupuntang District, Cirebon Regency, West Java.	Cisaat iku désa ing Kacamatan Dukupuntang, Kabupatèn Cirebon, Jawa Kulon.
Kepongpongan is a village in Talun District, Cirebon Regency, West Java.	Kepongpongan iku désa ing Kacamatan Talun, Kabupatèn Cirebon, Jawa Kulon.
Sindangkasih is a village in Beber District, Cirebon Regency, West Java.	Sindangkasih iku désa ing Kacamatan Beber, Kabupatèn Cirebon, Jawa Kulon.
The dam is a village in Pangenan District, Cirebon Regency, West Java.	Bendungan iku désa ing Kacamatan Pangenan, Kabupatèn Cirebon, Jawa Kulon.
Sendang is a village in Sumber District, Cirebon Regency, West Java.	Sendang iku kalurahan ing Kacamatan Sumber, Kabupatèn Cirebon, Jawa Kulon.
Babakan is a village in Sumber District, Cirebon Regency, West Java.	Babakan iku kalurahan ing Kacamatan Sumber, Kabupatèn Cirebon, Jawa Kulon.
Orimalang is a village in Jamblang District, Cirebon Regency, West Java.	Orimalang iku désa ing Kacamatan Jamblang, Kabupatèn Cirebon, Jawa Kulon.
Muara is a village in Suranenggala District, Cirebon Regency, West Java.	Muara iku désa ing Kacamatan Suranenggala, Kabupatèn Cirebon, Jawa Kulon.
Cigobang is a village in Pasaleman District, Cirebon Regency, West Java.	Cigobang iku désa ing Kacamatan Pasaleman, Kabupatèn Cirebon, Jawa Kulon.
Lemeng when it was just burned in the deling	Lemeng nalika nembe dipunbakar wonten salebeting deling
C and still manages to handle his game which is less consistent.	C lan ésih mbudidaya kanggo nangani permainané kang kurang konsistén.
Dubai has a diverse and multi-ethnic society.	Dubai menika gadhah masyarakat ingkang beda-beda lan multietnis.
His works are spread in various media and anthologies.	Karya-karyané sumebar ing manéka warna médhia lan antologi.
In the 1930s his farms did not make much profit.	Ing dasawarsa 1930-an paternakané ora patiya ngasilaké bathi akèh.
Kalio is the name of a rendang that is still half -finished.	Kalio inggih punika sebatan saking rendang ingkang tasih setengah dados.
Infinite compound flowers do not have true terminal flowers.	Kembang majemuk ora winates ora duwèni kembang terminal kang sejati.
The giant plant leaves a lot in tropical forests with wide leaves.	Tuwuhan buta godhong akèh ing alas tropis karo sudhut godhong.
There is no general agreement regarding the variety of flowers.	Durung ana sarujukan umum gegayutan manéka warna kembang.
Making this swing is not that difficult.	Anggenipun damel lenggang punika boten patia angel.
The umbrella leaf of a plant that grows a single lot.	Rwaning payung tuwuhan kang mundak akèh siji.
Rafinha is a left -handed center midfielder.	Rafinha kalebet gelandhang tengah kidal.
The flower groups are distinguished by the nature of the branches.	Golongan-golongan kembang kang mligi dibedakaké liwat sipaté cabang.
There are several area names for the elderly, such as:	Wonten sapérangan nama wewengkon kanggé tua, kadosta:
The leopard () is one of four large cats.	Macan tutul () iku salah siji saka papat kucing gedhé.
The country is mountainous, with deep slopes.	Negara iki wujudé gunung-gunung, kanthi èrèngan kang jero.
Latin writing more often uses “ghirsh” than “qirsh”.	Panulisan latin luwih asring nggunakaké "ghirsh" tinimbang "qirsh".
Oblak started his international career in 2012.	Oblak miwiti karir internasionalipun wiwit taun 2012.
In 1963, the government introduced halala to the public.	Ing taun 1963, pamaréntah nepangaké halala dhumateng masarakat.
Penggung is a village in Nawangan District, Pacitan Regency, East Java.	Penggung iku désa ing Kacamatan Nawangan, Kabupatèn Pacitan, Jawa Wétan.
Xiao'erjing has 36 letters and consists of 4 vowel letters.	Xiao'erjing nduweni 36 huruf lan dumadi 4 huruf vokal.
Xiao'erjing is written from right to left, just like how you write the Arabic alphabet.	Xiao'erjing ditulis saka tengen mengiwa, kaya cara nulis aksara Arab.
The Empire State Building is a symbol of United States culture.	Empire State Building dadi simbol kabudayané Amerika Serikat.
Bellerín started his career as a winger for FC Barcelona.	Bellerín miwiti karir minangka panyerang sayap kanggé FC Barcelona.
Shibuya is famous for its crossings.	Shibuya punika misuwur kanggo sawijining papan nyebrang.
In the course of his work, Adam often encountered strange occurrences.	Nalika nindakake  pakaryane,  Adam asring nemoni kadadeyan kang nyleneh.
Some of the companies headquartered in Shibuya are:	Sawetara perusahaan kang kantor punjeré ana ing Shibuya, ya iku:
Shibuya city council has 43 elected members.	Dewan kutha Shibuya nduwéni 43 anggota kapilih.
Kurzawa made his senior international debut in France in 2014.	Kurzawa damel debut internasional senioré ing Prancis nalika taun 2014.
Sukareja is a village in Tirtayuda District, Malang Regency, East Java.	Sukareja iku désa ing Kacamatan Tirtayuda, Kabupatèn Malang, Jawa Wétan.
Wanaagung is a village in Kasembon District, Malang Regency, East Java.	Wanaagung iku désa ing Kacamatan Kasembon, Kabupatèn Malang, Jawa Wétan.
Bantureja is a village in Ngantang District, Malang Regency, East Java.	Bantureja iku désa ing Kacamatan Ngantang, Kabupatèn Malang, Jawa Wétan.
Cibeunying Kaler is a district in the city of Bandung, West Java.	Cibeunying Kalèr iku kacamatan ing Kutha Bandhung, Jawa Kulon.
An attacker (red) drives the ball.	Sawijining panyerang (abang) nggiring bal.
Modern football began to flourish in England and became very popular.	Bal-balan modhèren wiwit ngrembaka ing Inggris lan dadi banget disenengi.
Tools used to care for bonsai	Piranti sing digunakake kanggo ngrawat bonsai
Full repetitive words are written in full using hyphens.	Tembung ulang penuh ditulis sacara pepak kanthi migunakaké tandha hubung.
The most important classification of human beings is based on gender.	Panggolongan manungsa kang paling utama yaiku dhedhasar jinis kelamin.
Plants or trees are made into canals by cutting their roots and stems.	Tandhuran utawi wit dipundamel cébol mawi ngethok oyot lan pangipun.
However, the copy was not then exactly as it was written.	Ananging, panyalinan iku ora banjur persis kaya kang tinulis.
Often the concept of an encyclopedia is confused with a dictionary.	Kerep konsèp ènsiklopédhi disalah-kaprahaké karo bausastra (kamus).
Most of the Tangerang area is a lowland.	Sapérangan gedhé wewengkon Tangerang wujud dhataran cendhèk.
Tangerang is a development area of ​​Jakarta.	Tangerang minangka wewengkon perkembangan Jakarta.
Bromartani also wrote Bramarthani was the first Javanese language newspaper.	Bromartani uga tinulis Bramarthani iku layang kabar basa Jawa pisanan.
Located in the area of ​​Cigeulis District are forests and plantations.	Dumunung ing wewengkon Kacamatan Cigeulis yaiku alas lan parkebunan.
Some of the villages located in Balaraja District are:	Sawetara désa kang dumunung ana ing Kacamatan Balaraja yaiku:
The city has a long history and is occupied by different countries.	Kutha iki nduwé sajarah dawa lan dikuwasani nagara sing béda-béda.
The rontal sheet is still blank.	Lembaran rontal kang isih kosong.
The edges of the rontal are also painted, usually with red paint.	Pinggiran rontal uga dicèt, lumrahé nganggo cèt warna abang.
The Warriors almost certainly had animals for a vehicle.	Para Jawata mèh mesthi gadhah kéwan kanggé satunggiling wahana.
The Sriwedari spelling adopts such a rule;	Ejaan Sriwedari nganut paugeran kaya mangkéné;
One of the famous grain warehouses in this city	Salah siji gudhang gandum misuwur ing kutha iki
Writing a fair article is an art that needs to be practiced.	Nulis sawijining artikel sing adil iku seni kang perlu kalatih.
One of the four was hollow and broken.	Wonten satunggiling patapan sampun suwung saha risak.
A few examples that might illustrate the points I will over-emphasize.	Sawetara tuladha sing bisa nerangaké poin sing bakal tak-tegasaké.
Developments that explain the history of Grudziądz	Perkembangan sing ndunungi sajarah Grudziądz
This book is good for an introduction to the history of Javanese literature.	Buku punika saé kanggé introdhuksi ing sajarah sastra Jawi.
The flag used in the official atmosphere has its emblem in the center.	Gendéra sing digunakaké ing swasana resmi ana lambangé ing tengah.
Now the administrative area of ​​this government is no more.	Saiki wewengkon administratif pamaréntahan iki wis ora ana.
This form of royal state or monarchy has many types.	Wangun nagara kraton utawa monarki iki nduwé akèh jinisé.
On the emblem of this city is a wolf that picks up a lamb.	Ing lambang kutha iki ana sregala sing nyokot cempé.
The word aran is grouped according to three categories: male, female and tidha.	Tembung aran diklumpukaké manut telung jati: jaler, éstri lan tidha.
The current design was introduced in 1938.	Rancangan saiki ditepungaké ing taun 1938.
The old Słubice coat of arms forms a shield divided in two.	Lambang Słubice sing lawas wujud tamèng sing dipara loro.
But where is the Dadapan area?	Nanging wonten pundi dunungipun tlatah Dadapan punika?
In contrast to my work it is like an elephant flying on the ground.	Béda karo gawéyanku kaya gajah kang mabur ing lemah.
Such was the end of the year -long battle.	Kaya ngono wekasané paprangan kang lawasé taunan.
During the night the raden escaped from the country.	Ing wanci dalu sang radèn lolos saking nagari.
The money was then hung up again.	Dhuwit papancèn mau banjur kagantung manèh.
In addition the allowance for the needs of the soldiers was made 1.	Kajaba iku dhuwit papancèn kanggo kapreluwaning prajurit kadadèkaké 1.
That time was because he was sick, so he didn’t experience a truce.	Wektu iku amarga dhèwèké lara, dadi ora ngalami gencatan senjata.
He received a gift of 4 apanage money.	Pethalé mau mawa tampa sasanggeman papanci dhuwit apanage 4.
The following powiats are grouped by province.	Ing ngisor iki powiat-powiat iki digrupaké miturut provinsi.
May all who hear, read or copy live long.	Amoga kabèh kang kerungu, maca utawa nyalin dawa umuré.
This duck is shaped almost like a kempyang	Kethuk iki wujudé meh padha karo kempyang
Chempala is beaten on the side of the box for a specific signal to the nayaga.	Chempala ditabuh ing sisih kothak kanggo isyarat tinentu kanggo nayaga.
The way to hold the flag is between the index finger and the middle finger.	Carané nyekel gendèr yaiku antarané driji tuding karo driji tengah.
The kendhang is played to accompany the wayang performance.	Kendhang iki racaké ditabuh kanggo ngiringi pagelaran wayang.
Saron demung has the lowest voice in the saron group.	Saron demung nduwé swara paling cendhèk ing kelompok saron.
Sindhen is a person who sings along to the sound of gamelan.	Sindhèn yaiku wong kang nembang mbarengi swaranè gamelan.
This drum is played together with a large drum.	Kendhang iki racaké ditabuh bareng karo kendhang ageng.
The shape of the large gong is similar to that of the racake gong which is circular.	Wujud gong ageng padha karo gong racaké yaiku bunder.
In the inscription it says that his government was famous and just.	Ing prasasti mau yèn pamaréntahané misuwur lan adil.
Example: will create a link box like the one on this side	Conto:  bakal gawé kothak pranala kaya ing sisih iki
Ciblon racake is beaten to accompany the dance.	Ciblon racaké ditabuh kanggo ngiringi jogèd.
Only administrators can delete articles.	Mung para panata sing bisa mbusak artikel.
The shape of this slenthem is almost the same as that of the gender.	Wujud slenthem iki mèh padha karo gendèr.
Depending on the genre of the place, the dynasty can be set on various scales.	Gumantung gènre saenggon, wangsi bisa disetèl ing manéka skala.
This type of middle saron is between peking and demung.	Iki jinis saron tengah-tengah yaiku antara peking lan demung.
Also listed in 8 counties and 1 city.	Uga  katata sajeroning 8 kabupatèn lan 1 kutha.
The province is divided into 18 districts and 5 cities.	Provinsi iki ketata sajeroning 18 kabupatèn lan 5 kutha.
This round describes a human being who is born into the world.	Babak iki nggambaraké manungsa kang dilairaké ing dunya.
All the performers behave as they do.	Sedaya juru paraga maragani minangka piyambakipun.
The barrel is a sound structure that constantly vibrates.	Laras ya iku tatanan swara kang ajeg getaranè.
Cengkok ya is a style or model of sindhennan.	Céngkok ya iku gaya utawa model sindhènan.
Planting is done on these pre-formed plots.	Nandur dilakokake ing petakan-petakan ingkang sampun dibentuk menika.
Kern published his literary work with the translation of many writings.	Kern babaraké karya sastra karo pertalan tulisan-tulisan sing akèh.
Reciprocals are sounds that consist of two sentences.	Wangsalan ya iku unèn-unèn kang dumadi saka rong ukara.
There are no limits to masterminds, musicians, and spectators.	Ora ana batesan kanggo dalang, pemusik, lan penonton.
At its opening weekend, the film grossed $ 27.	Ing bukaan akhir minggu, film iki entuk $ 27.
Brown beans that have been rolled with a peeling skin	Kacang buncis coklat sing wis digulung nganggo kulit peeling
The film received rave reviews from critics.	Film kasebut ditampa kanthi ulasan apik saka juru kritik.
The film was well received by critics.	Filem kasebut ditampa kanthi becik saka kritikus.
The film received a mix of critics.	Filem kasebut ditampa campuran saka kritikus.
Debate questions are purely litigants.	Pitakonan debat sifate namung pemantik.
The cocoa fruit has a thick skin, about 3cm.	Woh kakao iku nduweni kulit kang kandel, sawatara 3cm.
At its opening weekend, the film grossed $ 31.	Ing bukaan akhir minggu, film iki entuk $ 31.
Purbo is one of the best -selling wayang kulit dhalang from Solo.	Purbo kagolong salah siji dhalang wayang kulit laris saka Solo.
Belfast escaped the world war and became a museum ship in London.	Belfast lolos perang donya lan dadi prau musiyum ing London.
The Novitiate film received good reviews from critics.	Filem Novitiate nampa ulasan apik saka juru kritik.
Djajasiswaja was ordained a priest by Mgr.	Djajasiswaja ditahbisaké minangka imam déning Mgr.
